"expression","reading","meaning","tags","guid","meaning_vi"
"提案","ていあん","proposal, proposition, suggestion","JLPT JLPT_2 JLPT_3","iGm7,)MoHt","đề nghị, đề nghị, đề nghị"
"定期","ていき","fixed term","JLPT JLPT_2 JLPT_3","A!sHO/~:s^","thời hạn cố định"
"抵抗","ていこう","resistance, opposition","JLPT JLPT_2 JLPT_3","N(w.Tb~N=E","sự phản kháng, sự phản đối"
"提出","ていしゅつ","presentation, submission, filing","JLPT JLPT_2 JLPT_3","_gNbOk8-6","trình bày, đệ trình, nộp hồ sơ"
"停電","ていでん","failure of electricity","JLPT JLPT_2 JLPT_3","H}DrQpl/{h","mất điện"
"程度","ていど","degree, amount, level","JLPT JLPT_2 JLPT_3","F`R&X?&TVu","mức độ, số lượng, mức độ"
"停留所","ていりゅうじょ","bus or tram stop","JLPT JLPT_2 JLPT_3","Awx`muH^bu","trạm xe buýt hoặc xe điện"
"デート","デート","date (in the sense of 'social engagement' only)","JLPT Intermediate_Japanese JLPT_3 JLPT_2 Intermediate_Japanese_Ln.5 Genki_Ln.3 Genki","OE9g6(Wr!Q","ngày (chỉ theo nghĩa 'tương tác xã hội')"
"敵","てき","enemy, rival","JLPT JLPT_2 JLPT_3","Ea+9Js(Fd+","kẻ thù, đối thủ"
"出来事","できごと","incident happening, event","JLPT JLPT_2 JLPT_3","jSaj(o[]4Q","sự việc xảy ra, sự kiện"
"適する","てきする","to fit, to suit","JLPT JLPT_2 JLPT_3","BBp^;rnN&Z","để phù hợp, cho phù hợp"
"適切","てきせつ","appropriate, adequate, relevance","JLPT JLPT_2 JLPT_3","GJ78SM<nAC","thích đáng, thích đáng, thích đáng"
"適度","てきど","moderate","JLPT JLPT_2 JLPT_3","P,Aa?trXr^","vừa phải"
"適用","てきよう","applying","JLPT JLPT_2 JLPT_3","F[1:.C?p}A","áp dụng"
"できれば","できれば","if possible…","JLPT JLPT_2 JLPT_3","Nl1_P@+[2J","nếu có thể…"
"手品","てじな","conjuring trick, magic","JLPT JLPT_2 JLPT_3","Bmip}Vg}I5","trò ảo thuật, ảo thuật"
"ですから","ですから","therefore","JLPT JLPT_2 JLPT_3","Jo!p#Qfr#o","Vì vậy"
"鉄","てつ","iron","JLPT JLPT_2 JLPT_3","u7QQ@g<pTi","sắt"
"哲学","てつがく","philosophy","JLPT JLPT_2 JLPT_3","w4;9Z6RDj*","triết lý"
"手伝い","てつだい","help, helper, assistant","JLPT JLPT_2 JLPT_3","KsJJ=HC*D~","sự giúp đỡ, người giúp đỡ, người trợ giúp"
"徹底","てってい","thoroughness, completeness","JLPT JLPT_2 JLPT_3","u^FH5{m=7A","sự kỹ lưỡng, sự đầy đủ"
"鉄道","てつどう","railway; railroad","JLPT Intermediate_Japanese JLPT_3 JLPT_2 Intermediate_Japanese_Ln.10","fH8D~mT1*!","đường sắt; đường sắt"
"徹夜","てつや","staying up all night, sleepless night","JLPT Intermediate_Japanese JLPT_3 JLPT_2 Intermediate_Japanese_Ln.7","Lx.`K,!_&%","thức suốt đêm, mất ngủ"
"手間","てま","time, labor","JLPT JLPT_2 JLPT_3","zh##v%wLiw","thời gian, lao động"
"デモ","デモ","demo, demonstration","JLPT JLPT_2 JLPT_3","zxldW(*v39","sự trình diễn, sự trình diễn"
"典型","てんけい","type, pattern, archetypal","JLPT JLPT_2 JLPT_3","b#]l?Jh5h","kiểu, kiểu mẫu, nguyên mẫu"
"天候","てんこう","weather","JLPT JLPT_2 JLPT_3","Du(D%o0?(h","thời tiết"
"電子","でんし","electron; electronic","JLPT JLPT_2 JLPT_3","KF~X[<t._6","điện tử; điện tử"
"テント","テント","tent","JLPT JLPT_2 JLPT_3","C+]@`|c9$-","lều"
"伝統","でんとう","tradition, convention","JLPT JLPT_2 JLPT_3","b?a#:(nI:=","truyền thống, quy ước"
"天然","てんねん","nature, spontaneity","JLPT JLPT_2 JLPT_3","mJ@k+Q+jCj","tính chất, tính tự phát"
"問い","とい","question, query","JLPT JLPT_2 JLPT_3","qN5[}C*k;Z","câu hỏi, câu hỏi"
"党","とう","party (political)","JLPT JLPT_2 JLPT_3","CwN*@P-oun","đảng (chính trị)"
"塔","とう","tower, pagoda","JLPT JLPT_2 JLPT_3","K]pA87hQ2g","tháp, chùa"
"答案","とうあん","examination paper, examination script","JLPT JLPT_2 JLPT_3","MoK&)Fu]bx","giấy thi, kịch bản thi"
"同一","どういつ","identity, sameness, similarity","JLPT JLPT_2 JLPT_3","l<daK{7I?K","sự đồng nhất, sự giống nhau, sự giống nhau"
"銅貨","どうか","copper coin","JLPT JLPT_2 JLPT_3","v?#F}bohO.","đồng xu"
"当時","とうじ","at that time, in those days (same as そのころ)","JLPT Intermediate_Japanese JLPT_3 JLPT_2 Intermediate_Japanese_Ln.13","cAqI6F$%jo","vào thời điểm đó, vào những ngày đó (giống như そのころ)"
"動詞","どうし","verb","JLPT JLPT_2 JLPT_3","Jt^|GpM7=V","động từ"
"同時","どうじ","simultaneous(ly), same time","JLPT JLPT_2 JLPT_3","yvg^A$k^a|","đồng thời(ly), cùng lúc"
"どうしても","どうしても","at any cost, no matter what, no matter how hard one tries","JLPT Intermediate_Japanese JLPT_3 JLPT_2 Intermediate_Japanese_Ln.11","u>t|EJmDdT","bằng bất cứ giá nào, bất kể thế nào, bất kể người ta có cố gắng thế nào"
"どうぞよろしく","どうぞよろしく","pleased to meet you","JLPT JLPT_2 JLPT_3","k:&n.w>9]!","rất vui được gặp bạn"
"到着","とうちゃく","arrival","JLPT JLPT_2 JLPT_3","i)aR;Wlc03","đến"
"道徳","どうとく","morals","JLPT JLPT_2 JLPT_3","F<|nkQy)11","đạo đức"
"投票","とうひょう","voting, poll","JLPT JLPT_2 JLPT_3","NlT[;z*wrK","bỏ phiếu, thăm dò ý kiến"
"東洋","とうよう","Orient","JLPT JLPT_2 JLPT_3","kzZ}UECtrI","Phương Đông"
"同様","どうよう","identical, same (kind), like","JLPT JLPT_2 JLPT_3","w[nqm0x.)$","giống nhau, giống nhau (loại), giống như"
"童謡","どうよう","children's song, nursery rhyme","JLPT JLPT_2 JLPT_3","pW$[md&UnE","bài hát thiếu nhi, bài đồng dao"
"同僚","どうりょう","colleague; co-worker","JLPT Intermediate_Japanese JLPT_3 JLPT_2 Intermediate_Japanese_Ln.6 Genki Genki_Ln.21","Ra.t5JBS3r","đồng nghiệp; đồng nghiệp"
"道路","どうろ","road","JLPT JLPT_2 JLPT_3","zy.8&725kR","đường"
"通す","とおす","to let pass, to overlook, to continue","JLPT JLPT_2 JLPT_3","iHbDjUw`ah","cho qua, bỏ qua, tiếp tục"
"通り過ぎる","とおりすぎる","to pass, to pass through","JLPT JLPT_2 JLPT_3","n%iou*]&!6","đi qua, đi qua"
"都会","とかい","city","JLPT JLPT_2 JLPT_3","p*_|WF)kYy","thành phố"
"溶く","とく","to dissolve (paint)","JLPT JLPT_2 JLPT_3","M1t!(0fZzF","hòa tan (sơn)"
"解く","とく","to unfasten; answer, solve","JLPT JLPT_2 JLPT_3","b.j;M[.:j7","để cởi trói; trả lời, giải quyết"
"退く","どく","to retreat, to recede, to withdraw","JLPT JLPT_2 JLPT_3","c$$~C+pfb}","rút lui, rút ​​lui, rút ​​lui"
"毒","どく","poison, toxicant","JLPT JLPT_2 JLPT_3","DARItH3te]","chất độc, chất độc"
"得意","とくい","pride, triumph, prosperity","JLPT JLPT_2 JLPT_3","w<S{;~)l0:","niềm tự hào, chiến thắng, thịnh vượng"
"読書","どくしょ","reading","JLPT JLPT_2 JLPT_3","F6~L<UDvE+","đọc"
"独身","どくしん","single, unmarried","JLPT Intermediate_Japanese JLPT_3 JLPT_2 Intermediate_Japanese_Ln.14","img~a/~?x<","độc thân, chưa kết hôn"
"特徴","とくちょう","characteristic(s); feature(s); trait(s)","JLPT Intermediate_Japanese JLPT_3 JLPT_2 Intermediate_Japanese_Ln.10","dd#*-FyzHW","đặc trưng); đặc trưng); (các) đặc điểm"
"特長","とくちょう","forte, merit","JLPT JLPT_2 JLPT_3","e_t7Cd~09D","sở trường, công đức"
"独特","どくとく","peculiarity, uniqueness, characteristic","JLPT JLPT_2 JLPT_3","hWn,<pPOA","sự đặc biệt, sự độc đáo, đặc trưng"
"独立","どくりつ","independence (e.g., Ind. Day), self-support","JLPT JLPT_2 JLPT_3","wgVbY)l!G:","độc lập (ví dụ: Ngày Ind.), tự hỗ trợ"
"溶ける","とける","to melt, to thaw, to dissolve","JLPT JLPT_2 JLPT_3","Go3eNt+^C%","tan chảy, tan băng, hòa tan"
"解ける","とける","to come untied, to come apart","JLPT JLPT_2 JLPT_3","E_4w+LM=cF","được cởi trói, tách ra"
"どこか","どこか","somewhere, anywhere","JLPT JLPT_2 JLPT_3","n<7QA|Q%GZ","ở đâu đó, bất cứ nơi nào"
"ところが","ところが","however, while, even if","JLPT JLPT_2 JLPT_3","m-8$vGofT(","tuy nhiên, trong khi, thậm chí nếu"
"ところで","ところで","by the way; even if","JLPT Intermediate_Japanese JLPT_3 JLPT_2 Intermediate_Japanese_Ln.1","yzfKCn.aBb","Nhân tiện; ngay cả khi"
"登山","とざん","mountain-climbing","JLPT JLPT_2 JLPT_3","N-%3i1PqFk","leo núi"
"都市","とし","town, city, urban","JLPT JLPT_2 JLPT_3","tNXI!+#v:`","thị trấn, thành phố, đô thị"
"年月","としつき","months and years","JLPT JLPT_2 JLPT_3","b%`/I;RJ$^","tháng và năm"
"図書","としょ","books","JLPT JLPT_2 JLPT_3","e>Nm^AgJ])","sách"
"年寄","としより","old people, the aged","JLPT JLPT_2 JLPT_3","dH(n+sRgp{","người già, người già"
"閉じる","とじる","to close (e.g., book, eyes), to shut","JLPT JLPT_2 JLPT_3","JWs?hJ:*yD","đóng lại (ví dụ: sách, mắt), đóng lại"
"途端","とたん","just (now, at the moment, etc.)","JLPT JLPT_2 JLPT_3","hC>h/uXgyk","chỉ (bây giờ, vào lúc này, v.v.)"
"土地","とち","plot of land, lot, soil","JLPT JLPT_2 JLPT_3","d;>FkWx>zj","lô đất, lô đất"
"突然","とつぜん","abruptly, suddenly, unexpectedly","JLPT JLPT_2 JLPT_3","u9EG(SkQ{j","đột ngột, đột ngột, bất ngờ"
"トップ","トップ","top","JLPT JLPT_2 JLPT_3","q]>Jr![.(N","đứng đầu"
"届く","とどく","to reach","JLPT JLPT_2 JLPT_3","e?<7!g}yZ;","để đạt được"
"とにかく","とにかく","anyhow, at any rate, anyway","JLPT JLPT_3 JLPT_2 Genki Genki_Ln.21","im{&K_@wV","dù sao đi nữa, dù thế nào đi nữa"
"飛ばす","とばす","to skip over, to omit","JLPT JLPT_2 JLPT_3","Hs}AOgVJU~","bỏ qua, bỏ qua"
"飛び出す","とびだす","to jump out, to rush out, to fly out","JLPT JLPT_2 JLPT_3","jD`AkcS%la","nhảy ra, lao ra, bay ra"
"留める","とめる","to fasten, to turn off, to detain","JLPT JLPT_2 JLPT_3","EluezN4]RV","buộc chặt, tắt, giam giữ"
"泊める","とめる","to have someone stay (over night) (v.t.)","JLPT Intermediate_Japanese JLPT_3 JLPT_2 Intermediate_Japanese_Ln.1","sr$3#;WnNi","để có ai đó ở lại (qua đêm) (v.t.)"
"友","とも","friend, companion, pal","JLPT JLPT_2 JLPT_3","I(06/Hp@B7","bạn bè, bạn đồng hành, bạn thân"
"共に","ともに","sharing with, participate in","JLPT JLPT_2 JLPT_3","J&blXp45W[","chia sẻ với, tham gia vào"
"虎","とら","tiger","JLPT JLPT_2 JLPT_3","q3*!nq{_pc","con hổ"
"ドライブ","ドライブ","drive, driving","JLPT Genki_Ln.11 JLPT_3 JLPT_2 Genki","I,~F.X8Z8F","lái xe, lái xe"
"トラック","トラック","truck; (running) track","JLPT JLPT_2 JLPT_3","q*_SbJJ@!!","xe tải; (chạy) đường đua"
"ドラマ","ドラマ","drama","JLPT JLPT_2 JLPT_3","mL~N]Bfwf}","kịch"
"トランプ","トランプ","playing cards (lit: trump)","JLPT JLPT_2 JLPT_3","m&n=U!*VAu","chơi bài (lit: trump)"
"取り上げる","とりあげる","to take up, to pick up; to confiscate","JLPT JLPT_2 JLPT_3","hUa->MmssI","nhặt lên, nhặt lên; tịch thu"
"努力","どりょく","great effort, exertion, endeavor","JLPT Intermediate_Japanese JLPT_3 JLPT_2 Intermediate_Japanese_Ln.14","P$}d5=b$SY","nỗ lực lớn, nỗ lực, cố gắng"
"トレーニング","トレーニング","training","JLPT JLPT_2 JLPT_3","h-6r=v)@/P","đào tạo"
"ドレス","ドレス","dress","JLPT JLPT_2 JLPT_3","wj.H_PUH[6","đầm"
"取れる","とれる","to come off, to be taken off","JLPT JLPT_2 JLPT_3","Hw{&qvpk7n","đi ra, được cất cánh"
"泥","どろ","mud","JLPT JLPT_2 JLPT_3","d(Q$9Oy/;r","bùn"
"トン","トン","ton (1000 lbs.)","JLPT JLPT_2 JLPT_3","c$BFN)`=lz","tấn (1000 lbs.)"
"とんでもない","とんでもない","outrageous, No way!","JLPT JLPT_2 JLPT_3","bl*lVwAn^S","quá đáng, Không thể nào!"
"どんなに","どんなに","how, how much","JLPT JLPT_2 JLPT_3","AecyZ~s0IY","như thế nào, bao nhiêu"
"トンネル","トンネル","tunnel","JLPT JLPT_2 JLPT_3","gyvzV/QL,O","đường hầm"
"名","な","name, reputation","JLPT JLPT_2 JLPT_3","O0j|#CZ{DW","tên tuổi, danh tiếng"
"内容","ないよう","subject, contents, detail","JLPT JLPT_2 JLPT_3","i{JT|O:vZ0","chủ đề, nội dung, chi tiết"
"なお","なお","still, yet","JLPT JLPT_2 JLPT_3","x$e]XDdzMn","vẫn còn, chưa"
"仲","なか","relation, relationship","JLPT JLPT_2 JLPT_3","x6DIm?q|TP","mối quan hệ, mối quan hệ"
"流す","ながす","to drain, to float, to shed (e.g., blood, tears)","JLPT JLPT_2 JLPT_3","b9+3bd5x%g","chảy ra, trôi đi, chảy ra (ví dụ: máu, nước mắt)"
"半ば","なかば","middle, halfway","JLPT JLPT_2 JLPT_3","m<2jyxDj3g","giữa, nửa chừng"
"仲間","なかま","company, fellow, colleague, associate","JLPT JLPT_2 JLPT_3","O~m#4j_48)","công ty, đồng nghiệp, đồng nghiệp, cộng sự"
"中身","なかみ","content(s); substance","JLPT Intermediate_Japanese JLPT_3 JLPT_2 Intermediate_Japanese_Ln.13","J`BoSI)KdS","(các) nội dung; chất"
"中味","なかみ","contents, interior, filling","JLPT JLPT_2 JLPT_3","iXe{m_#VVd","nội dung, nội thất, điền"
"眺め","ながめ","scene; view; prospect; outlook","JLPT Intermediate_Japanese JLPT_3 JLPT_2 Intermediate_Japanese_Ln.10","q7BF&&<kDs","bối cảnh; xem; triển vọng; triển vọng"
"眺める","ながめる","to view, to gaze at","JLPT JLPT_2 JLPT_3","Jux]l79hU7","để xem, nhìn vào"
"流れ","ながれ","stream, current","JLPT JLPT_2 JLPT_3","d.aR+yRU]C","dòng chảy, dòng chảy"
"流れる","ながれる","to flow, to be washed away","JLPT JLPT_2 JLPT_3","L(]6kjxkO5","chảy đi, bị cuốn đi"
"亡くす","なくす","to lose someone","JLPT JLPT_2 JLPT_3","KL@%|R=4Tw","mất ai đó"
"殴る","なぐる","to strike; to hit; to punch","JLPT JLPT_3 JLPT_2 Genki Genki_Ln.21","eS]UZnH]O8","tấn công; đánh ; đấm"
"無し","なし","without","JLPT JLPT_2 JLPT_3","tUofx+jM%K","không có"
"なぜなら","なぜなら","because","JLPT JLPT_2 JLPT_3","H{Gk:ou^*M","bởi vì"
"謎","なぞ","riddle, puzzle, enigma","JLPT JLPT_2 JLPT_3","NDO,I}[;_1","câu đố, câu đố, điều bí ẩn"
"納得","なっとく","consent, assent, understanding","JLPT JLPT_2 JLPT_3","JuwJ4CGSR`","sự đồng ý, sự đồng ý, sự hiểu biết"
"何か","なにか","something","JLPT JLPT_3 JLPT_2 Genki_Ln.8 Genki","j.C?;uY)C5","thứ gì đó"
"なにも","なにも","nothing","JLPT JLPT_2 JLPT_3","MXWN];^p1V","Không có gì"
"鍋","なべ","saucepan, pot","JLPT JLPT_2 JLPT_3","mwf<LRd<l+","cái chảo, cái nồi"
"生","なま","raw, unprocessed","JLPT JLPT_2 JLPT_3","r*Fk8g)/r@","thô, chưa qua chế biến"
"怠ける","なまける","to be idle, to neglect","JLPT JLPT_2 JLPT_3","yx?2EFwB,]","lười biếng, bỏ mặc"
"波","なみ","wave","JLPT JLPT_2 JLPT_3","pN{_T4/c^1","sóng"
"涙","なみだ","tear","JLPT JLPT_2 JLPT_3","oRUb;($Ghp","xé"
"悩む","なやむ","to agonize, to be troubled","JLPT Intermediate_Japanese JLPT_3 JLPT_2 Intermediate_Japanese_Ln.14","bu-LsE_(B1","làm khổ sở, gặp rắc rối"
"鳴らす","ならす","to ring, to sound","JLPT JLPT_2 JLPT_3","i97JG)YBV+","rung chuông, phát ra âm thanh"
"為る","なる","to change, to be of use, to reach to","JLPT JLPT_2 JLPT_3","bNL#{T]zX=","để thay đổi, để được sử dụng, để đạt tới"
"生る","なる","to bear fruit","JLPT JLPT_2 JLPT_3","L4foi?c6%U","sinh hoa trái"
"馴れる","なれる","to become domesticated, to become tame","JLPT JLPT_2 JLPT_3","ol(4_S7K{0","trở nên thuần hóa, trở nên thuần hóa"
"縄","なわ","rope","JLPT JLPT_2 JLPT_3","n`oE5IcC;2","dây thừng"
"何で","なんで","Why, What for","JLPT JLPT_2 JLPT_3","HqNM3@mEGg","Tại sao, để làm gì"
"何でも","なんでも","by all means, everything","JLPT JLPT_2 JLPT_3","KLOu@z)~5u","bằng mọi cách, mọi thứ"
"何とか","なんとか","somehow, anyhow, one way or another","JLPT JLPT_2 JLPT_3","PsxfE&mMV)","bằng cách nào đó, dù thế nào đi nữa, bằng cách này hay cách khác"
"似合う","にあう","to suit (a person), to match (clothing), (something) becomes (someone)","JLPT Intermediate_Japanese JLPT_3 JLPT_2 Intermediate_Japanese_Ln.11","jtNV<xuHWD","phù hợp với (một người), phù hợp (quần áo), (cái gì đó) trở thành (ai đó)"
"煮える","にえる","to boil, to cook, to be cooked","JLPT JLPT_2 JLPT_3","bik,,M3:tN","đun sôi, nấu, nấu chín"
"苦手","にがて","poor (at), weak (in), dislike (of)","JLPT JLPT_2 JLPT_3","M3gYUPwtEh","kém (tại), yếu (trong), không thích (của)"
"握る","にぎる","to grasp, to seize, to mold sushi","JLPT JLPT_2 JLPT_3","vmSd+R!f5d","nắm, nắm, nặn sushi"
"日","にち","day","JLPT JLPT_2 JLPT_3","Nod.Sq)g|g","ngày"
"日常","にちじょう","ordinary, regular, everyday","JLPT JLPT_2 JLPT_3","m=K]ZkdB>_","bình thường, đều đặn, hàng ngày"
"日光","にっこう","sunlight","JLPT JLPT_2 JLPT_3","O|V6=xs6Hv","Ánh sáng mặt trời"
"日中","にっちゅう","daytime, broad daylight","JLPT JLPT_2 JLPT_3","1%wJTAZoF","ban ngày, ban ngày"
"にっこり","にっこり","smile sweetly, smile, grin","JLPT JLPT_2 JLPT_3","A?rMl+E(~y","cười ngọt ngào, cười tươi, cười toe toét"
"日本","にっぽん","Japan","JLPT JLPT_2 JLPT_3","xVTGJL[~Hv","Nhật Bản"
"日本","にほん","Japan","JLPT JLPT_3 JLPT_2 Genki_Ln.1 Genki","PdXU2>,+,$","Nhật Bản"
"入場","にゅうじょう","entrance, admission, entering","JLPT JLPT_2 JLPT_3","zYrH7+;Jc+","sự vào, sự vào, sự vào"
"煮る","にる","to boil, to cook","JLPT JLPT_2 JLPT_3","GsAuw,hW%.","đun sôi, nấu"
"人気","にんき","popularity","JLPT JLPT_2 JLPT_3","IO!K5zC:])","sự nổi tiếng"
"人間","にんげん","human being, person","JLPT Intermediate_Japanese JLPT_3 JLPT_2 Intermediate_Japanese_Ln.11","to[4Ed0}","con người, con người"
"抜く","ぬく","to extract, to omit, to unplug","JLPT JLPT_2 JLPT_3","J$S#dr#O.=","rút ra, bỏ qua, rút ​​phích cắm"
"抜ける","ぬける","to come out, to fall out, to be omitted","JLPT JLPT_2 JLPT_3","J{iiC<@SQ{","đi ra, rơi ra, bị bỏ qua"
"布","ぬの","cloth","JLPT JLPT_2 JLPT_3","q$ysjT]VCx","vải"
"濡らす","ぬらす","to wet, to soak","JLPT JLPT_2 JLPT_3","z@Vcw1=;j2","làm ướt, ngâm"
"根","ね","root","JLPT JLPT_2 JLPT_3","d=p6h26.c<","gốc"
"値","ね","value, price, cost","JLPT JLPT_2 JLPT_3","EQ[K4a8j3!","giá trị, giá cả, chi phí"
"願い","ねがい","desire, wish, request","JLPT JLPT_2 JLPT_3","sUyGKFZ%Xv","mong muốn, mong muốn, yêu cầu"
"願う","ねがう","to desire, to wish, to request","JLPT JLPT_2 JLPT_3","2e?!QE;A1","mong muốn, mong muốn, yêu cầu"
"鼠","ねずみ","mouse, rat","JLPT JLPT_2 JLPT_3","G}*K+YvkrL","chuột, chuột"
"熱帯","ねったい","tropics","JLPT JLPT_2 JLPT_3","kkWXGyi|&~","vùng nhiệt đới"
"熱中","ねっちゅう","enthusiasm, zeal, mania","JLPT JLPT_2 JLPT_3","lPMoEzcLqx","sự nhiệt tình, nhiệt tình, hưng cảm"
"年間","ねんかん","year","JLPT JLPT_2 JLPT_3","d_NdY-B:AA","năm"
"年月","ねんげつ","months and years","JLPT JLPT_2 JLPT_3","p^QZ#pHDS+","tháng và năm"
"年中","ねんじゅう","whole year, always, everyday","JLPT JLPT_2 JLPT_3","E0SJPrLvM7","cả năm, luôn luôn, hàng ngày"
"年代","ねんだい","age, era, period","JLPT JLPT_2 JLPT_3","wqq!d<%$gr","thời đại, thời đại, thời kỳ"
"年齢","ねんれい","age, years","JLPT JLPT_2 JLPT_3","lI,ZQ1?Z/$","tuổi, năm"
"野","の","field","JLPT JLPT_2 JLPT_3","y-+2`{({f&","cánh đồng"
"能","のう","being skilled in, nicely, properly","JLPT JLPT_2 JLPT_3","m[Pt*UAu7d","có kỹ năng, tốt, đúng cách"
"農家","のうか","farmer, farm family","JLPT JLPT_2 JLPT_3","v*vXrV&l.l","nông dân, gia đình nông dân"
"農業","のうぎょう","agriculture","JLPT Intermediate_Japanese JLPT_3 JLPT_2 Intermediate_Japanese_Ln.10","A3L<i~4B/)","nông nghiệp"
"農民","のうみん","farmers, peasants","JLPT JLPT_2 JLPT_3","l^C||-Q@FF","nông dân, nông dân"
"能力","のうりょく","ability, faculty","JLPT JLPT_2 JLPT_3","PQ%>W3<m<u","khả năng, khoa"
"ノー","ノー","no","JLPT JLPT_2 JLPT_3","A$DCH!&r|T","KHÔNG"
"軒","のき","eaves","JLPT JLPT_2 JLPT_3","DjCz-B0?P;","mái hiên"
"残す","のこす","to leave (behind, over), to save, to reserve","JLPT JLPT_2 JLPT_3","G9}3C/kn`n","để lại (phía sau, phía trên), để dành, dự trữ"
"残り","のこり","remaining, left-over","JLPT JLPT_2 JLPT_3","1Ev%4g:!#","còn sót lại, còn sót lại"
"乗せる","のせる","to place on (something), to take on board","JLPT JLPT_2 JLPT_3","P;&]8~|B5t","đặt lên (cái gì), mang lên tàu"
"載せる","のせる","to place on (something); to publish","JLPT JLPT_2 JLPT_3","c~;t;&Vnza","đặt vào (cái gì đó); xuất bản"
"覗く","のぞく","to peek in, to look in","JLPT JLPT_2 JLPT_3","Hy+I.kN0`%","nhìn vào, nhìn vào"
"除く","のぞく","to remove, to exclude, to except","JLPT JLPT_2 JLPT_3","y<H]05[a~3","loại bỏ, loại trừ, ngoại trừ"
"望み","のぞみ","wish, desire, (a) hope","JLPT JLPT_2 JLPT_3","QMT.-k$<Eb","mong muốn, mong muốn, (a) hy vọng"
"望む","のぞむ","to desire, to wish for; to view","JLPT JLPT_2 JLPT_3","eI17,m{o4{","mong muốn, mong muốn; để xem"
"後","のち","afterwards, since then","JLPT JLPT_2 JLPT_3","Rbg3w%yZT]","sau đó, kể từ đó"
"ノック","ノック","knock; fungo (baseball)","JLPT JLPT_2 JLPT_3","I|?mZ`76Sc","cú đánh; nấm (bóng chày)"
"伸ばす","のばす","to extend, to stretch, to reach out","JLPT JLPT_2 JLPT_3","xaB1#1Nz$","kéo dài, kéo dài, vươn tới"
"延ばす","のばす","to extend, to stretch, to reach out","JLPT JLPT_2 JLPT_3","MCU^h_@4jl","kéo dài, kéo dài, vươn tới"
"伸びる","のびる","to extend, to make progress, to grow","JLPT JLPT_2 JLPT_3","BVa+StSI^2","mở rộng, tiến bộ, phát triển"
"延びる","のびる","to be prolonged","JLPT JLPT_2 JLPT_3","h;x99>{wy|","được kéo dài"
"述べる","のべる","to state, to express, to mention","JLPT Intermediate_Japanese JLPT_3 JLPT_2 Intermediate_Japanese_Ln.13","vf(j*ek(yX","phát biểu, bày tỏ, đề cập đến"
"上る","のぼる","to ascend, to go up, to climb","JLPT JLPT_2 JLPT_3","n99IdD&<1l","đi lên, đi lên, leo lên"
"昇る","のぼる","to arise, to ascend, to go up","JLPT JLPT_2 JLPT_3","B@kvH2BlIF","nổi lên, đi lên, đi lên"
"載る","のる","to appear (in print), to be recorded","JLPT JLPT_2 JLPT_3","Nibr^Gs/g<","xuất hiện (trong bản in), được ghi lại"
"のんびり","のんびり","carefree, at leisure","JLPT JLPT_3 JLPT_2 Genki_Ln.22 Genki","lW(_0K#qr1","vô tư, nhàn hạ"
"場","ば","place, field (physics)","JLPT JLPT_2 JLPT_3","GDd)tLjDFI","địa điểm, lĩnh vực (vật lý)"
"はあ (かん)","はあ (かん)","(sigh)","JLPT JLPT_2 JLPT_3","q->2~QuZ7t","(thở dài)"
"パーセント","パーセント","percent","JLPT JLPT_2 JLPT_3","tRJyHS5V6y","phần trăm"
"灰","はい","ash","JLPT JLPT_2 JLPT_3","yp;].asZlp","tro"
"梅雨","ばいう","rainy season","JLPT JLPT_2 JLPT_3","PSy.Vi_[#","mùa mưa"
"バイオリン","バイオリン","violin","JLPT Genki_Ln.13 JLPT_3 JLPT_2 Genki","P0|;%A4sXQ","violon"
"ハイキング","ハイキング","hiking","JLPT JLPT_2 JLPT_3","HcQ1$Os%x4","đi bộ đường dài"
"配達","はいたつ","delivery, distribution","JLPT JLPT_2 JLPT_3","xw:Qj132Wm","giao hàng, phân phối"
"パイプ","パイプ","pipe; channels official or otherwise","JLPT JLPT_2 JLPT_3","l4YS(}+dg9","đường ống; kênh chính thức hoặc cách khác"
"俳優","はいゆう","actor, actress, performer","JLPT Intermediate_Japanese JLPT_3 JLPT_2 Intermediate_Japanese_Ln.13","fZuFXWr:[`","diễn viên, nữ diễn viên, người biểu diễn"
"パイロット","パイロット","pilot","JLPT JLPT_2 JLPT_3","bJuDn%>JBm","phi công"
"生える","はえる","to grow, to spring up; to cut (teeth)","JLPT JLPT_2 JLPT_3","H`:KnzwCJZ","lớn lên, mọc lên; cắt (răng)"
"墓","はか","grave, tomb","JLPT JLPT_2 JLPT_3","wyd?,|D3$8","mộ, ngôi mộ"
"馬鹿","ばか","fool, idiot","JLPT JLPT_2 JLPT_3","NNq|t=8Aut","đồ ngốc, đồ ngốc"
"博士","はかせ","doctorate, PhD., doctor","JLPT JLPT_2 JLPT_3","ya}G1t{rx^","tiến sĩ, tiến sĩ, tiến sĩ"
"計る","はかる","to measure, to weigh, to survey","JLPT JLPT_2 JLPT_3","r=0WeQKi!d","đo, cân, khảo sát"
"量る","はかる","to measure, to weigh, to survey","JLPT JLPT_2 JLPT_3","CRts&/>]cr","đo, cân, khảo sát"
"測る","はかる","to measure, to weigh, to survey","JLPT JLPT_2 JLPT_3","E)0?EIUz7g","đo, cân, khảo sát"
"掃く","はく","to sweep, to brush, to gather up","JLPT JLPT_2 JLPT_3","vSCJIFU380","quét, chải, thu thập"
"吐く","はく","to throw up, to vomit","JLPT Intermediate_Japanese JLPT_3 JLPT_2 Intermediate_Japanese_Ln.12","wVP@*4xm(:","nôn ra, nôn ra"
"拍手","はくしゅ","clapping hands, applause","JLPT JLPT_2 JLPT_3","QlF4N)gbDJ","vỗ tay, vỗ tay"
"莫大","ばくだい","enormous, vast","JLPT JLPT_2 JLPT_3","E~?/H3*fy6","to lớn, rộng lớn"
"爆発","ばくはつ","explosion, detonation, eruption","JLPT JLPT_2 JLPT_3","g9VYFn:WwV","sự nổ, sự nổ, sự phun trào"
"博物館","はくぶつかん","museum","JLPT JLPT_2 JLPT_3","LpU/`O$e<h","bảo tàng"
"激しい","はげしい","violent, vehement, intense","JLPT JLPT_2 JLPT_3","v6}uu]rF:b","bạo lực, mãnh liệt, mãnh liệt"
"はさみ","はさみ","scissors","JLPT JLPT_2 JLPT_3","eD|fBc0re3","kéo"
