"expression","reading","meaning","tags","guid","meaning_vi"
"映す","うつす","to project, to reflect, to cast (shadow)","JLPT JLPT_2 JLPT_3","v%$=^xk|L|","chiếu, phản ánh, tạo ra (bóng)"
"訴える","うったえる","to complain, to appeal, to sue (a person)","JLPT Intermediate_Japanese JLPT_3 JLPT_2 Intermediate_Japanese_Ln.12","q3vDC2@R>l","khiếu nại, khiếu nại, kiện (một người)"
"写る","うつる","to be photographed, to be projected","JLPT JLPT_2 JLPT_3","CI<Sr}lwt|","được chụp ảnh, được chiếu"
"映る","うつる","to be reflected, to come out (photo)","JLPT JLPT_2 JLPT_3","b:A%=5OyPu","được phản ánh, đi ra (ảnh)"
"うなる","うなる","to groan, to moan","JLPT JLPT_2 JLPT_3","s+o0tk>SxK","rên rỉ, rên rỉ"
"奪う","うばう","to rob, to deprive","JLPT JLPT_2 JLPT_3","wyO.=2:4&2","cướp, tước đoạt"
"馬","うま","horse; promoted bishop (in Japanese chess known as shogi)","JLPT Intermediate_Japanese JLPT_3 JLPT_2 Intermediate_Japanese_Ln.10","I-Qwz&8r5B","ngựa; thăng quân tượng (trong cờ vua Nhật Bản gọi là shogi)"
"生まれ","うまれ","birth, birth-place","JLPT JLPT_2 JLPT_3","deVvQ9]dKk","nơi sinh, nơi sinh"
"有無","うむ","yes or no, presence or absence","JLPT JLPT_2 JLPT_3","q6A?^f?DMI","có hay không, có mặt hay vắng mặt"
"梅","うめ","plum, lowest (of a three-tier ranking system)","JLPT JLPT_2 JLPT_3","unQPf%DK.[","mận, thấp nhất (trong hệ thống xếp hạng ba cấp)"
"埋める","うめる","to bury, to fill up, to fill (a seat, a vacant position)","JLPT JLPT_2 JLPT_3","wtEE639hh4","lấp đầy, lấp đầy (chỗ ngồi, chỗ trống)"
"裏切る","うらぎる","to betray, to turn traitor","JLPT JLPT_2 JLPT_3","hCN[eLWk|~","phản bội, trở thành kẻ phản bội"
"羨ましい","うらやましい","envious, enviable","JLPT JLPT_2 JLPT_3","P/?}=]sJqp","ghen tị, đáng ghen tị"
"売れる","うれる","to be sold","JLPT JLPT_2 JLPT_3","wjQK4P,#&y","được bán"
"噂","うわさ","rumor, gossip","JLPT JLPT_2 JLPT_3","iJw30XJ732","tin đồn, tin đồn"
"運","うん","fortune, luck","JLPT JLPT_2 JLPT_3","niW>.BR,WX","vận may, may mắn"
"運転","うんてん","operation, driving","JLPT JLPT_2 JLPT_3","x@0Upz+IK7","vận hành, lái xe"
"柄","え","handle (of a sword, dagger, etc.), grip","JLPT_1 JLPT JLPT_2 JLPT_3","vAFwXg-!s2","tay cầm (của một thanh kiếm, dao găm, v.v.), tay cầm"
"永遠","えいえん","eternity, perpetuity, immortality","JLPT JLPT_2 JLPT_3","DxPif#CAiw","sự vĩnh cửu, sự vĩnh viễn, sự bất tử"
"永久","えいきゅう","eternity, perpetuity, immortality","JLPT JLPT_2 JLPT_3","H2N,Hwk+O>","sự vĩnh cửu, sự vĩnh viễn, sự bất tử"
"影響","えいきょう","influence, effect","JLPT Intermediate_Japanese JLPT_3 JLPT_2 Intermediate_Japanese_Ln.9","xzq]$1i3z}","ảnh hưởng, tác dụng"
"営業","えいぎょう","business, trade, management","JLPT JLPT_2 JLPT_3","xesLH`A]]j","kinh doanh, thương mại, quản lý"
"衛星","えいせい","satellite","JLPT_1 JLPT JLPT_2 JLPT_3","mODPl+GnJ<","vệ tinh"
"栄養","えいよう","nutrition, nourishment","JLPT JLPT_2 JLPT_3","D*<eW1UGaQ","dinh dưỡng, dinh dưỡng"
"笑顔","えがお","smile (on one's face)","JLPT Intermediate_Japanese JLPT_3 JLPT_2 Intermediate_Japanese_Ln.11","ck|m~NB,1+","mỉm cười (trên khuôn mặt của một người)"
"描く","えがく","to draw, to depict, to describe","JLPT JLPT_2 JLPT_3","A%|&4/hW0O","vẽ, mô tả, miêu tả"
"餌","えさ","feed, bait","JLPT JLPT_2 JLPT_3","kFT)$ftn@z","thức ăn, mồi"
"エネルギー","エネルギー","energy (GER: energie)","JLPT JLPT_2 JLPT_3","z36oBXl-RE","năng lượng (GER: năng lượng)"
"得る","える","to get, to gain, to win, to learn","JLPT Intermediate_Japanese JLPT_3 JLPT_2 Intermediate_Japanese_Ln.11","v$jA3Lrsi]","để có được, để đạt được, để giành chiến thắng, để học hỏi"
"得る","うる","to get, to gain, to win","JLPT JLPT_2 JLPT_3","sT#y1FGTc!","để có được, để đạt được, để giành chiến thắng"
"円","えん","circle, yen","JLPT JLPT_2 JLPT_3","lsb6<icN4?","vòng tròn, yên"
"延期","えんき","postponement, adjournment","JLPT JLPT_2 JLPT_3","DUXFS%Wd#v","sự hoãn lại, sự hoãn lại"
"演技","えんぎ","acting, performance","JLPT JLPT_2 JLPT_3","IH<gd>zmOh","diễn xuất, biểu diễn"
"援助","えんじょ","assistance, aid, support","JLPT JLPT_2 JLPT_3","h`{I^&2VL&","sự giúp đỡ, sự giúp đỡ, sự hỗ trợ"
"エンジン","エンジン","engine","JLPT JLPT_2 JLPT_3","qw.wG*b!Qa","động cơ"
"演説","えんぜつ","speech, address","JLPT JLPT_2 JLPT_3","ubLUzysT08","bài phát biểu, địa chỉ"
"演奏","えんそう","musical performance","JLPT JLPT_2 JLPT_3","G9]&KRGi[P","biểu diễn âm nhạc"
"老い","おい","old age, the aged","JLPT JLPT_2 JLPT_3","Hz1%S/^$?,","tuổi già, người già"
"追い付く","おいつく","to overtake, to catch up (with)","JLPT JLPT_2 JLPT_3","g{~7a$v2sm","vượt qua, bắt kịp (với)"
"王","おう","king","JLPT JLPT_2 JLPT_3","k#_<4ay=~G","nhà vua"
"追う","おう","to chase, to run after","JLPT JLPT_2 JLPT_3","x%>16|CvCA","đuổi theo, chạy theo"
"応援","おうえん","aid, assistance, help","JLPT JLPT_2 JLPT_3","NDS^Ak)|LB","viện trợ, giúp đỡ, giúp đỡ"
"王様","おうさま","king","JLPT JLPT_2 JLPT_3","nKPemrJ_V5","nhà vua"
"王子","おうじ","prince","JLPT JLPT_2 JLPT_3","L`,J_WL+]h","hoàng tử"
"応じる","おうじる","to adapt, to respond, to comply with","JLPT Intermediate_Japanese JLPT_3 JLPT_2 Intermediate_Japanese_Ln.14","xK:s,vBFc7","thích ứng, đáp ứng, tuân theo"
"横断","おうだん","crossing","JLPT JLPT_2 JLPT_3","z/T^y6%uiO","đi qua"
"終える","おえる","to finish","JLPT JLPT_2 JLPT_3","hO,Zn$Rx<F","để kết thúc"
"大いに","おおいに","much, considerably (same as 大変 (たいへん)), greatly","JLPT Intermediate_Japanese JLPT_3 JLPT_2 Intermediate_Japanese_Ln.13","fVz%iJ3-E?","nhiều, đáng kể (giống như 大変 (たいへん)), rất nhiều"
"覆う","おおう","to cover, to hide, to conceal","JLPT JLPT_2 JLPT_3","Lm%oB!j+E)","che đậy, che giấu, giấu kín"
"大家","おおや","landlord","JLPT JLPT_2 JLPT_3","gc9}{t}#g|","chủ nhà"
"丘","おか","hill, height","JLPT JLPT_2 JLPT_3","j@=CkW8>0!","đồi, độ cao"
"沖","おき","open sea","JLPT JLPT_2 JLPT_3","d?Pt2wu__v","biển khơi"
"奥","おく","interior, inner part","JLPT JLPT_2 JLPT_3","V}(}>#0tD","phần bên trong, phần bên trong"
"贈る","おくる","to present, to give to, to award to","JLPT JLPT_2 JLPT_3","rV3X4}6{nQ","tặng, trao cho, trao giải cho"
"起こる","おこる","to occur, to happen","JLPT JLPT_2 JLPT_3","jY1}sGq4X}","xảy ra, xảy ra"
"押える","おさえる","to stop, to restrain, to press down","JLPT JLPT_2 JLPT_3","Om1hU>MYS0","dừng lại, kiềm chế, đè xuống"
"幼い","おさない","very young, childish","JLPT JLPT_2 JLPT_3","uA[`]K&k.D","rất trẻ, trẻ con"
"収める","おさめる","to store to pay, to supply","JLPT JLPT_2 JLPT_3","jL2$>p8($[","lưu trữ để thanh toán, cung cấp"
"納める","おさめる","to store to pay, to supply","JLPT JLPT_2 JLPT_3","I#wxPQAM&H","lưu trữ để thanh toán, cung cấp"
"治める","おさめる","to govern, to manage; to subdue","JLPT JLPT_2 JLPT_3","Groy5Mh=b[","cai trị, quản lý; khuất phục"
"お辞儀","おじぎ","bow","JLPT JLPT_2 JLPT_3","N&e8jCT!9`","cây cung"
"お洒落","おしゃれ","smartly dressed, fashion-conscious","JLPT JLPT_2 JLPT_3","q1.@7#(;?<","ăn mặc lịch sự, có ý thức thời trang"
"お喋り","おしゃべり","chattering, talk","JLPT JLPT_2 JLPT_3","J0fhZBKfSu","tán gẫu, nói chuyện"
"汚染","おせん","pollution, contamination","JLPT JLPT_2 JLPT_3","I?+Cu[l]f]","sự ô nhiễm, sự ô nhiễm"
"恐らく","おそらく","perhaps","JLPT JLPT_2 JLPT_3","kL/tl<Mv0J","có lẽ"
"恐れる","おそれる","to fear, to be afraid of","JLPT JLPT_2 JLPT_3","x;Xt$GbU:n","sợ hãi, sợ hãi"
"恐ろしい","おそろしい","terrible, dreadful","JLPT JLPT_2 JLPT_3","JGyLnws+gz","khủng khiếp, khủng khiếp"
"教わる","おそわる","to be taught","JLPT JLPT_2 JLPT_3","j.|V-R,hM8","được dạy"
"お互い","おたがい","mutual, reciprocal, each other","JLPT Intermediate_Japanese JLPT_3 JLPT_2 Intermediate_Japanese_Ln.1","I%(y!,oeu|","lẫn nhau, hỗ tương, lẫn nhau"
"穏やか","おだやか","calm, gentle, quiet","JLPT JLPT_2 JLPT_3","iQhH7HaHk_","bình tĩnh, nhẹ nhàng, yên tĩnh"
"男の人","おとこのひと","man","JLPT JLPT_3 JLPT_2 Genki_Ln.7 Genki","Bqnqcw;5C8","người đàn ông"
"大人しい","おとなしい","obedient, docile, quiet","JLPT JLPT_2 JLPT_3","NiKO$K>WA9","ngoan ngoãn, ngoan ngoãn, im lặng"
"劣る","おとる","to fall behind, to be inferior to","JLPT JLPT_2 JLPT_3","Kb0v_SukC>","tụt lại phía sau, tụt lại phía sau"
"鬼","おに","ogre, demon, 'it' (e.g.,in a game of tag)","JLPT JLPT_2 JLPT_3","Ewa5_MZt)z","yêu tinh, quỷ dữ, 'nó' (ví dụ: trong trò chơi đuổi bắt)"
"帯","おび","band, sash","JLPT JLPT_2 JLPT_3","x^<)4<JIn8","ban nhạc, thắt lưng"
"お昼","おひる","lunch, noon","JLPT JLPT_2 JLPT_3","QU,c7/WKET","bữa trưa, buổi trưa"
"オフィス","オフィス","office","JLPT JLPT_2 JLPT_3","t+v1qGjm`2","văn phòng"
"溺れる","おぼれる","to be drowned, to indulge in","JLPT JLPT_2 JLPT_3","L6mI#frmDD","bị chết đuối, để đắm chìm trong"
"お前","おまえ","you (sing), presence (of a high personage)","JLPT JLPT_2 JLPT_3","kiGe-uw>iW","bạn (hát), sự hiện diện (của một nhân vật cao)"
"おめでとう","おめでとう","Congratulations!, an auspicious occasion!","JLPT JLPT_2 JLPT_3","IjwH:94kN^","Xin chúc mừng!, một dịp tốt lành!"
"お目に掛かる","おめにかかる","meet ~, see ~","JLPT JLPT_2 JLPT_3","O[qSUns&-f","gặp ~, gặp ~"
"思い付く","おもいつく","to think of, to hit upon","JLPT JLPT_2 JLPT_3","phC=E!Uzsp","nghĩ đến, đánh vào"
"思い出","おもいで","memories, recollections, reminiscence","JLPT JLPT_3 JLPT_2 Genki_Ln.23 Genki","C>r<Y|QfhA","ký ức, hồi ức, sự hồi tưởng"
"主に","おもに","mainly, primarily","JLPT JLPT_2 JLPT_3","KJv^Ck6t)-","chủ yếu, chủ yếu"
"思わず","おもわず","unintentional, spontaneous","JLPT JLPT_2 JLPT_3","mqEM$vUJ]Z","vô tình, tự phát"
"泳ぎ","およぎ","swimming","JLPT JLPT_2 JLPT_3","p%YEcD<#qK","bơi lội"
"およそ","およそ","about, roughly, approximately","JLPT JLPT_2 JLPT_3","cmb!OC{1dV","khoảng, đại khái, xấp xỉ"
"及ぼす","およぼす","to exert, to cause, to exercise","JLPT JLPT_2 JLPT_3","lC%7ty:^eB","dùng sức, gây ra, luyện tập"
"下す","おろす","to lower, to let go down","JLPT JLPT_2 JLPT_3","JRZI*AHd)D","hạ xuống, thả xuống"
"降ろす","おろす","to take down, to launch, to drop","JLPT JLPT_2 JLPT_3","PQD_mXy>W.","hạ xuống, phóng lên, thả xuống"
"卸す","おろす","to sell wholesale, grated (vegetables)","JLPT JLPT_2 JLPT_3","GT*kAh$cd0","bán sỉ, xay (rau củ)"
"音","おん","sound, note","JLPT JLPT_2 JLPT_3","gkN]*wY]?s","âm thanh, ghi chú"
"恩","おん","favor, obligation, debt of gratitude","JLPT JLPT_2 JLPT_3","A4Iq0-B@,;","ân huệ, nghĩa vụ, món nợ ân tình"
"温暖","おんだん","warmth","JLPT JLPT_2 JLPT_3","N&n<_QP1.Q","sự ấm áp"
"温度","おんど","temperature","JLPT JLPT_2 JLPT_3","NA1Ge#l-~k","nhiệt độ"
"可","か","passable","JLPT JLPT_2 JLPT_3","l:l&EInHym","có thể qua được"
"蚊","か","mosquito","JLPT JLPT_3 JLPT_2 Genki Genki_Ln.21","j=4=()Uwi2","muỗi"
"課","か","department, division","JLPT JLPT_2 JLPT_3","QQ1!.:!+a[","khoa, bộ phận"
"カー","カー","car","JLPT JLPT_2 JLPT_3","o!p+_Rb<h*","xe hơi"
"カード","カード","card, curd","JLPT JLPT_2 JLPT_3","F,Np^@m5hi","thẻ, sữa đông"
"貝","かい","shell, shellfish","JLPT JLPT_2 JLPT_3","HNd6/BU{>X","vỏ, động vật có vỏ"
"害","がい","harm, damage","JLPT JLPT_2 JLPT_3","g|Fzqe^$7$","tổn hại, tổn hại"
"会員","かいいん","member, the membership","JLPT JLPT_2 JLPT_3","li]JQ4<Kd[","thành viên, thành viên"
"絵画","かいが","picture, painting","JLPT JLPT_2 JLPT_3","emKUHOyrV`","bức tranh, bức tranh"
"海外","かいがい","foreign, abroad, overseas","JLPT JLPT_2 JLPT_3","qq4=IgxkU<","nước ngoài, nước ngoài, nước ngoài"
"会計","かいけい","account, finance","JLPT JLPT_2 JLPT_3","bX?OL%f/L+","tài khoản, tài chính"
"解決","かいけつ","settlement, solution, resolution","JLPT JLPT_2 JLPT_3","rmn(v?B?3g","giải quyết, giải quyết, giải quyết"
"会合","かいごう","meeting, assembly","JLPT JLPT_2 JLPT_3","f9BQ|i/j|}","cuộc họp, sự lắp ráp"
"外交","がいこう","diplomacy","JLPT JLPT_2 JLPT_3","A]90<@ohwE","ngoại giao"
"開始","かいし","start, commencement, beginning","JLPT JLPT_2 JLPT_3","qgkolirBJK","bắt đầu, bắt đầu, bắt đầu"
"解釈","かいしゃく","explanation, interpretation","JLPT JLPT_2 JLPT_3","Ih/AkEg/|E","sự giải thích, diễn giải"
"外出","がいしゅつ","outing, going out","JLPT JLPT_2 JLPT_3","Ol@%UFQ/rD","đi chơi, đi chơi"
"改善","かいぜん","betterment, improvement","JLPT JLPT_2 JLPT_3","fv+>GYURp:","sự cải thiện, sự cải thiện"
"快適","かいてき","pleasant, agreeable","JLPT JLPT_2 JLPT_3","Bh^`k;OTy|","dễ chịu, dễ chịu"
"回復","かいふく","recovery (from illness), rehabilitation, restoration","JLPT JLPT_2 JLPT_3","wc6OB#:n9.","phục hồi (sau bệnh tật), phục hồi, phục hồi"
"飼う","かう","to keep; to own (a pet); to raise; to feed","JLPT Genki_Ln.11 JLPT_3 JLPT_2 Genki","wfURRt4tC[","giữ ; sở hữu (thú cưng); nâng cao; cho ăn"
"帰す","かえす","to send back","JLPT JLPT_2 JLPT_3","LZ<.!]FC|8","gửi lại"
"代える","かえる","to exchange, to interchange, to substitute","JLPT JLPT_2 JLPT_3","Ccj6!`~jPu","trao đổi, trao đổi, thay thế"
"替える","かえる","to exchange, to interchange, to substitute","JLPT JLPT_2 JLPT_3","Fv2F,v+u]8","trao đổi, trao đổi, thay thế"
"換える","かえる","to exchange, to interchange, to substitute","JLPT JLPT_3 JLPT_2 Genki_Ln.23 Genki","mmtj;wD(Zd","trao đổi, trao đổi, thay thế"
"反る","かえる","to warp, to be warped, to curve","JLPT JLPT_2 JLPT_3","vDLMxa,sN/","làm cong, làm cong, làm cong"
"香り","かおり","aroma, fragrance","JLPT JLPT_2 JLPT_3","me}_g<26n*","hương thơm, hương thơm"
"画家","がか","painter","JLPT JLPT_2 JLPT_3","Pl:-st.KZ+","họa sĩ"
"抱える","かかえる","to hold or carry under or in the arms","JLPT JLPT_2 JLPT_3","PQR[r=WB$,","để giữ hoặc mang theo hoặc trong vòng tay"
"価格","かかく","price, value","JLPT JLPT_2 JLPT_3","xFP@p4LxH5","giá cả, giá trị"
"化学","かがく","chemistry","JLPT JLPT_2 JLPT_3","Sh/.K7MGJ","hoá học"
"輝く","かがやく","to shine, to glitter, to sparkle","JLPT JLPT_2 JLPT_3","Dzyp)tD%e","tỏa sáng, lấp lánh, lấp lánh"
"係","かかり","person in charge","JLPT JLPT_2 JLPT_3","Q&QZSK._J<","người phụ trách"
"罹る","かかる","to suffer from","JLPT JLPT_2 JLPT_3","h_Phc0xEm%","phải chịu đựng"
"限る","かぎる","to restrict, to limit, to confine","JLPT JLPT_2 JLPT_3","Ku)jdi.uTn","hạn chế, giới hạn, giới hạn"
"掻く","かく","to scratch","JLPT JLPT_2 JLPT_3","K):N$B19m+","gãi"
"描く","かく","to draw, to depict, to describe","JLPT JLPT_2 JLPT_3","grO;5{y}I|","vẽ, mô tả, mô tả"
"嗅ぐ","かぐ","to sniff, to smell","JLPT JLPT_2 JLPT_3","vaKqc&PyP9","đánh hơi, ngửi"
"家具","かぐ","furniture","Genki_Ln.15 JLPT JLPT_3 JLPT_2 Genki","gqN}MYosw6","nội thất"
"学","がく","learning, knowledge","JLPT JLPT_2 JLPT_3","w:XhV>-rir","học tập, kiến ​​thức"
"額","がく","amount; frame","JLPT JLPT_2 JLPT_3","iG]&$wbDKv","số lượng; khung"
"覚悟","かくご","resolution, resignation, readiness","JLPT JLPT_2 JLPT_3","j/*:m6x0J)","giải quyết, từ chức, sẵn sàng"
"確実","かくじつ","certainty, reliability, soundness","JLPT JLPT_2 JLPT_3","Nzie2SM<&O","sự chắc chắn, độ tin cậy, sự chắc chắn"
"学者","がくしゃ","scholar","JLPT JLPT_2 JLPT_3","RamhNRc=y:","học giả"
"学習","がくしゅう","study, learning","JLPT JLPT_2 JLPT_3","PHg7|5Zlfd","học tập, học tập"
"隠す","かくす","to hide, to conceal","JLPT JLPT_2 JLPT_3","vMufH!:aAV","che giấu, che giấu"
"拡大","かくだい","magnification, enlargement","JLPT JLPT_2 JLPT_3","f7kQq91Ua<","phóng đại, phóng đại"
"確認","かくにん","affirmation, confirmation","JLPT JLPT_2 JLPT_3","kk{ITQ}D*5","sự khẳng định, sự xác nhận"
"学問","がくもん","scholarship, study, learning","JLPT JLPT_2 JLPT_3","Jk{+Uk9@=d","học bổng, học tập, học tập"
"隠れる","かくれる","to hide, to be hidden","JLPT JLPT_2 JLPT_3","Iv9k~&!9Sa","ẩn náu, ẩn giấu"
"影","かげ","shade, shadow, other side","JLPT JLPT_2 JLPT_3","e~q8TnSV#A","bóng râm, bóng tối, phía bên kia"
"陰","かげ","shade, shadow, other side","JLPT JLPT_2 JLPT_3","JZ1GmL8t.y","bóng râm, bóng tối, phía bên kia"
"欠ける","かける","to be lacking","JLPT JLPT_2 JLPT_3","c*r`UH]nG8","bị thiếu"
"加減","かげん","adjustment; addition and subtraction","JLPT JLPT_2 JLPT_3","h.?lP}8!)~","điều chỉnh; phép cộng và phép trừ"
"過去","かこ","past","JLPT Intermediate_Japanese JLPT_3 JLPT_2 Intermediate_Japanese_Ln.13","dbDE7?,;2l","quá khứ"
"籠","かご","basket, cage","JLPT JLPT_2 JLPT_3","nt-Kbv73>]","giỏ, lồng"
"囲む","かこむ","to surround, to encircle","JLPT JLPT_2 JLPT_3","AC8Gt39]%,","bao quanh, vây quanh"
"火災","かさい","conflagration, fire","JLPT JLPT_2 JLPT_3","C?jW[uV]~u","hỏa hoạn, hỏa hoạn"
"重なる","かさなる","to be piled up, lie on top of one another","JLPT JLPT_2 JLPT_3","qEGvs]3ApH","được xếp chồng lên nhau, nằm chồng lên nhau"
"重ねる","かさねる","to pile up, to put something on another, to heap up","JLPT JLPT_2 JLPT_3","i%7_$Pa~m]","chất chồng lên, chất cái gì đó lên cái khác, chồng chất lên"
"飾り","かざり","decoration","JLPT JLPT_2 JLPT_3","b$htguAWNP","trang trí"
"貸し","かし","loan, lending","JLPT JLPT_2 JLPT_3","hK1t$y~&<","cho vay, cho vay"
"菓子","かし","confectionery, sweet","JLPT JLPT_2 JLPT_3","uK+`Lg$t0E","bánh kẹo, ngọt ngào"
"家事","かじ","household matters; housework (same as 家の仕事 (いえのしごと))","JLPT Intermediate_Japanese JLPT_3 JLPT_2 Intermediate_Japanese_Ln.14 Genki_Ln.22 Genki","oS4iCB;y-f","household matters; việc nhà (giống như 家の仕事 (いえのしごと))"
"賢い","かしこい","wise, clever, smart","JLPT JLPT_2 JLPT_3","rE7F6b61Rm","khôn ngoan, thông minh, thông minh"
"歌手","かしゅ","singer","JLPT Genki_Ln.11 JLPT_3 JLPT_2 Genki","NmC8EM=]mA","ca sĩ"
"数","かず","number, figure, amount","JLPT Intermediate_Japanese JLPT_3 JLPT_2 Intermediate_Japanese_Ln.3","DD:chgc^KO","con số, con số, số lượng"
"稼ぐ","かせぐ","to earn income, to labor","JLPT JLPT_2 JLPT_3","rzTOas5wcB","để kiếm thu nhập, lao động"
"数える","かぞえる","to count","JLPT JLPT_2 JLPT_3","J-q>{61#D9","đếm"
"型","かた","mold, model, style","JLPT JLPT_2 JLPT_3","p8F!A2no<N","khuôn mẫu, kiểu dáng, phong cách"
"肩","かた","shoulder","JLPT JLPT_2 JLPT_3","dyYF&B&tH[","vai"
"堅い","かたい","hard, firm, solid","JLPT JLPT_2 JLPT_3","Pf^;5Zn/;l","cứng, chắc, rắn chắc"
"硬い","かたい","hard, firm, solid","JLPT JLPT_2 JLPT_3","A5A<hg!,v}","cứng, chắc, rắn chắc"
"方々","かたがた","persons","JLPT JLPT_2 JLPT_3","hkfynYZJHd","người"
"片付く","かたづく","to put in order, to solve","JLPT JLPT_2 JLPT_3","ijUQHB/ROv","sắp xếp, giải quyết"
"刀","かたな","sword, saber","JLPT JLPT_2 JLPT_3","E>:sV*K^8H","kiếm, kiếm"
"語る","かたる","to talk, to tell, to recite","JLPT JLPT_2 JLPT_3","K~y=o(hWS(","nói, kể, kể lại"
"勝ち","かち","win, victory","JLPT JLPT_2 JLPT_3","f)TI}tuNi!","chiến thắng, chiến thắng"
"価値","かち","value, worth, merit","JLPT JLPT_2 JLPT_3","B$%nCt/^FZ","giá trị, giá trị, công đức"
"がっかり","がっかり","feel disappointed, be dejected, lose heart","JLPT JLPT_2 JLPT_3","r9|(w>UYj4","cảm thấy thất vọng, chán nản, mất lòng"
"活気","かっき","vigor; liveliness; vitality; energy","JLPT Intermediate_Japanese JLPT_1 JLPT_3 JLPT_2 Intermediate_Japanese_Ln.10","HUA^lTjb!P","sức sống; sự sống động; sức sống; năng lượng"
"楽器","がっき","musical instrument","JLPT Genki_Ln.13 JLPT_3 JLPT_2 Genki","zj[&tINbu_","nhạc cụ"
"学期","がっき","term (school)","JLPT JLPT_2 JLPT_3","rPinGb_30Q","học kỳ (trường học)"
"活動","かつどう","action, activity","JLPT JLPT_2 JLPT_3","wt]>L`Ku^c","hành động, hoạt động"
"活躍","かつやく","activity","JLPT JLPT_2 JLPT_3","eCZu2QGL8i","hoạt động"
"活用","かつよう","conjugation; practical use","JLPT JLPT_2 JLPT_3","fVw4kRg|j)","chia động từ; sử dụng thực tế"
"仮定","かてい","assumption, supposition, hypothesis","JLPT JLPT_2 JLPT_3","O=OdQ3=*sS","giả định, giả định, giả thuyết"
"過程","かてい","process","JLPT JLPT_2 JLPT_3","x/zB4*S269","quá trình"
"課程","かてい","course, curriculum","JLPT JLPT_2 JLPT_3","g,{yU7}}eo","khóa học, giáo trình"
"悲しむ","かなしむ","to be sad, to mourn for, to regret","JLPT JLPT_2 JLPT_3","z^+]Gk=mf_","buồn, thương tiếc, tiếc nuối"
"必ずしも","かならずしも","(not) always, (not) necessarily","JLPT JLPT_2 JLPT_3","vW8w*Wj8S6","(không) luôn luôn, (không) nhất thiết"
"かなり","かなり","considerably, fairly, quite","JLPT Intermediate_Japanese JLPT_3 JLPT_2 Intermediate_Japanese_Ln.7","zc@WXAK&cO","đáng kể, khá, khá"
"金","かね","gold, metal; money","JLPT JLPT_2 JLPT_3","sL^]E[vBWQ","vàng, kim loại; tiền bạc"
"鐘","かね","bell, chime","JLPT JLPT_2 JLPT_3","uWo]p3>gV)","chuông, chuông"
"可能","かのう","possible, practicable, feasible","JLPT JLPT_2 JLPT_3","s89#AFndfj","có thể, có thể thực hiện được, có thể thực hiện được"
"株","かぶ","stock; stump (of tree)","JLPT JLPT_2 JLPT_3","i!::Yg?ZPB","Cổ phần; gốc cây (của cây)"
"被る","かぶる","to wear; to be covered with","JLPT JLPT_2 JLPT_3","KZvZ3xJvf=","để mặc; được bao phủ bởi"
"我慢","がまん","patience, endurance, perseverance","JLPT JLPT_2 JLPT_3","b.uAP*cO(_","kiên nhẫn, sức chịu đựng, sự kiên trì"
"上","かみ","first volume; superior quality; governmental","JLPT JLPT_2 JLPT_3","B2f-z2M%?X","tập đầu tiên; chất lượng vượt trội; chính phủ"
"神","かみ","god","JLPT JLPT_2 JLPT_3","bOG}3!+.y2","chúa"
"雷","かみなり","thunder","JLPT JLPT_2 JLPT_3","A`y:r{2n8V","sấm sét"
"髪の毛","かみのけ","hair (head)","JLPT JLPT_2 JLPT_3","k>oV)Rt7]w","tóc (đầu)"
"科目","かもく","(school) subject, curriculum, course","JLPT JLPT_2 JLPT_3","mt1}<&PDy^","(trường học) môn học, chương trình giảng dạy"
"かもしれない","かもしれない","maybe, perhaps","JLPT JLPT_2 JLPT_3","fXI7dlE,H5","có lẽ, có lẽ"
"かゆい","かゆい","itchy, itching","JLPT JLPT_2 JLPT_3","i@bIkK/P`w","ngứa, ngứa"
"歌謡","かよう","song, ballad","JLPT JLPT_2 JLPT_3","B8j5MHOl3a","bài hát, bản ballad"
"空","から","empty","JLPT JLPT_2 JLPT_3","LiJsM!pT#,","trống"
"殻","から","shell, husk, hull","JLPT JLPT_2 JLPT_3","F87p.DC4,p","vỏ, trấu, vỏ"
"柄","がら","pattern; build; character","JLPT JLPT_2 JLPT_3","uk^tW>*afz","mẫu; xây dựng; tính cách"
"刈る","かる","to cut (hair), to mow (grass), to harvest","JLPT JLPT_2 JLPT_3","ON/-tkLwG!","cắt (tóc), cắt (cỏ), thu hoạch"
"河","かわ","river, stream","JLPT JLPT_2 JLPT_3","mIM2jXP:@M","sông, suối"
"皮","かわ","skin, hide, leather","JLPT JLPT_2 JLPT_3","C<.^aCL_QG","da, da, da"
"革","かわ","leather","JLPT JLPT_2 JLPT_3","z`KQfm{h;f","da thú"
"可愛そう","かわいそう","poor, pitiable, pathetic","JLPT JLPT_2 JLPT_3","jCbD|/Ou5e","nghèo, đáng thương, đáng thương"
"可愛らしい","かわいらしい","lovely, sweet","JLPT JLPT_2 JLPT_3","KYl^v5PK_;","đáng yêu, ngọt ngào"
"乾かす","かわかす","to dry","JLPT JLPT_2 JLPT_3","JoU47]zU{d","làm khô"
"渇く","かわく","to be thirsty","JLPT JLPT_2 JLPT_3","g:zQk;6g:U","khát nước"
"代る","かわる","to take the place of, to relieve, to be substituted for","JLPT JLPT_2 JLPT_3","f9j%&rI)[J","thay thế, làm nhẹ bớt, thay thế cho"
"缶","かん","can, tin","JLPT_1 JLPT JLPT_2 JLPT_3","fnx%_qW>Wk","lon, thiếc"
"勘","かん","perception, intuition, the sixth sense","JLPT JLPT_2 JLPT_3","lle<t+CbfW","nhận thức, trực giác, giác quan thứ sáu"
"考え","かんがえ","thinking, thought, ideas","JLPT JLPT_2 JLPT_3","ry3gkU$VWf","suy nghĩ, suy nghĩ, ý tưởng"
"感覚","かんかく","sense, sensation","JLPT JLPT_2 JLPT_3","p)VaZN,wP=","giác quan, cảm giác"
"間隔","かんかく","space, interval, SPC","JLPT JLPT_2 JLPT_3","qbs8.xdCB<","không gian, khoảng, SPC"
"観客","かんきゃく","audience, spectator(s)","JLPT Intermediate_Japanese JLPT_3 JLPT_2 Intermediate_Japanese_Ln.7","j%h6<&[KnW","khán giả, khán giả"
