"expression","reading","meaning","tags","guid","meaning_vi"
"光景","こうけい","scene, spectacle","JLPT JLPT_2 JLPT_3","uTN)wO>N*m","cảnh, cảnh tượng"
"合計","ごうけい","sum total, total amount","JLPT JLPT_2 JLPT_3","z@(R~.`dKi","tổng cộng, tổng số tiền"
"攻撃","こうげき","attack, strike, offensive","JLPT JLPT_2 JLPT_3","fbxr=B^K{z","tấn công, tấn công, tấn công"
"貢献","こうけん","contribution, services","JLPT JLPT_2 JLPT_3","im57ib}9qS","đóng góp, dịch vụ"
"広告","こうこく","advertisement","JLPT Genki_Ln.13 Intermediate_Japanese JLPT_3 JLPT_2 Intermediate_Japanese_Ln.15 Genki","qa5XPpB~K$","quảng cáo"
"交際","こうさい","friendship, association, acquaintance","JLPT JLPT_2 JLPT_3","nH$6L6<H;R","tình bạn, sự kết giao, sự quen biết"
"校舎","こうしゃ","school building","JLPT JLPT_2 JLPT_3","x5W<B+BK>R","xây dựng trường học"
"後者","こうしゃ","the latter","JLPT JLPT_2 JLPT_3","kUquk|vi;&","cái sau"
"工場","こうば","factory, plant","JLPT JLPT_2 JLPT_3","kU8AM-,iY!","nhà máy, nhà máy"
"公正","こうせい","justice, fairness, impartiality","JLPT JLPT_2 JLPT_3","N@!)sH2_75","sự công bằng, sự công bằng, sự công bằng"
"構成","こうせい","organization, composition","JLPT JLPT_2 JLPT_3","Fd-KLO&b~!","tổ chức, thành phần"
"高速","こうそく","high speed, high gear","JLPT JLPT_2 JLPT_3","B,HIrwQ4QK","tốc độ cao, hộp số cao"
"行動","こうどう","action, conduct, behavior","JLPT JLPT_2 JLPT_3","Q_m+2cq0*[","hành động, hành động, hành vi"
"強盗","ごうとう","robbery, burglary","JLPT JLPT_2 JLPT_3","lC8A_#]SF+","vụ cướp, vụ trộm"
"後輩","こうはい","junior members of a group","JLPT JLPT_3 JLPT_2 Genki_Ln.22 Genki","exC.)`@)h[","thành viên cấp dưới của một nhóm"
"幸福","こうふく","happiness, blessedness","JLPT JLPT_2 JLPT_3","KnC^{e}c.-","hạnh phúc, phước lành"
"公平","こうへい","fairness, impartial, justice","JLPT JLPT_2 JLPT_3","HfCG]C,9b3","sự công bằng, sự công bằng, sự công bằng"
"候補","こうほ","candidacy","JLPT JLPT_2 JLPT_3","jI7M_ck/=4","ứng cử"
"考慮","こうりょ","consideration, taking into account","JLPT JLPT_2 JLPT_3","ORy-9jIY.M","xem xét, tính đến"
"越える","こえる","to exceed, to cross over, to cross","JLPT JLPT_2 JLPT_3","Ps<w%<}`Nz","vượt qua, vượt qua, vượt qua"
"超える","こえる","to exceed, to cross over, to cross","JLPT JLPT_2 JLPT_3","rn/xivT%1v","vượt qua, vượt qua, vượt qua"
"コーチ","コーチ","coach","JLPT JLPT_2 JLPT_3","E.482d:D0W","huấn luyện viên"
"コード","コード","code; cord; chord","JLPT JLPT_2 JLPT_3","QKH0$=zpP3","mã số; dây; dây nhau"
"氷","こおり","ice, hail","JLPT JLPT_2 JLPT_3","jVp@v3rS)h","băng, mưa đá"
"凍る","こおる","to freeze, to be frozen over, to congeal","JLPT JLPT_2 JLPT_3","A<P8Ao~%+S","đóng băng, bị đóng băng, đông lại"
"ゴール","ゴール","goal","JLPT JLPT_2 JLPT_3","PTY>]PCTXK","mục tiêu"
"誤解","ごかい","misunderstanding","JLPT Intermediate_Japanese JLPT_3 JLPT_2 Intermediate_Japanese_Ln.15","FY37~etpV/","sự hiểu lầm"
"語学","ごがく","language study","JLPT Intermediate_Japanese JLPT_3 JLPT_2 Intermediate_Japanese_Ln.8","lSZ`^u4$^l","học ngôn ngữ"
"呼吸","こきゅう","breath, respiration","JLPT JLPT_2 JLPT_3","HYaR{=4wss","hơi thở, hô hấp"
"故郷","こきょう","hometown","JLPT JLPT_2 JLPT_3","x[p9$Yy?#r","quê hương"
"極","ごく","quite, very","JLPT JLPT_2 JLPT_3","x-os]7T;c","khá, rất"
"国語","こくご","national language","JLPT JLPT_2 JLPT_3","P(9q-`0&O-","quốc ngữ"
"国籍","こくせき","nationality","JLPT JLPT_2 JLPT_3","r.}Cb086.1","quốc tịch"
"黒板","こくばん","blackboard","JLPT Intermediate_Japanese JLPT_3 JLPT_2 Intermediate_Japanese_Ln.13","gM[VFRJO/m","bảng đen"
"克服","こくふく","conquest, overcome","JLPT JLPT_2 JLPT_3","cg-)t|ngzK","chinh phục, vượt qua"
"国民","こくみん","national, people, citizen","JLPT JLPT_2 JLPT_3","K+q@X-WIB[","quốc gia, nhân dân, công dân"
"穀物","こくもつ","grain, cereal, corn","JLPT JLPT_2 JLPT_3","EVuq#tu]8|","ngũ cốc, ngũ cốc, ngô"
"腰","こし","hip, waist","JLPT JLPT_2 JLPT_3","m<9C4|i/Uj","hông, eo"
"胡椒","こしょう","pepper","JLPT JLPT_2 JLPT_3","b)_&^<=JnX","hạt tiêu"
"個人","こじん","individual, private person","JLPT Intermediate_Japanese JLPT_3 JLPT_2 Intermediate_Japanese_Ln.14","xJ9*Qc)q|;","cá nhân, cá nhân"
"越す","こす","to go over (e.g., with audience)","JLPT JLPT_2 JLPT_3","N~a2o@b;S|","đi qua (ví dụ: với khán giả)"
"超す","こす","to cross, to pass, to tide over","JLPT JLPT_2 JLPT_3","E.}3vgSSP~","vượt qua, vượt qua, vượt qua"
"国家","こっか","state, country, nation","JLPT JLPT_2 JLPT_3","g^&ilH.z=f","tiểu bang, quốc gia, dân tộc"
"国会","こっかい","National Diet, parliament, congress","JLPT JLPT_2 JLPT_3","xLo2`0x`}C","Quốc hội, Quốc hội, Quốc hội"
"国境","こっきょう","national or state border","JLPT JLPT_2 JLPT_3","ni,}~dk?wC","biên giới quốc gia hoặc tiểu bang"
"骨折","こっせつ","bone fracture","JLPT JLPT_2 JLPT_3","KXTKU$f!R4","gãy xương"
"小包","こづつみ","parcel, package","JLPT JLPT_2 JLPT_3","EPSe<f!:WV","bưu kiện, gói"
"琴","こと","Japanese harp","JLPT JLPT_2 JLPT_3","lswbJ>f(+[","đàn hạc nhật bản"
"異なる","ことなる","to differ, to vary","JLPT JLPT_2 JLPT_3","GI=<w6vpiE","khác biệt, khác biệt"
"諺","ことわざ","proverb, saying","JLPT JLPT_2 JLPT_3","NY!nEVJ<.6","câu tục ngữ, câu nói"
"断る","ことわる","to refuse, to decline, to dismiss","JLPT JLPT_2 JLPT_3","g8Tps~wm2h","từ chối, từ chối, bác bỏ"
"粉","こな","flour, powder","JLPT JLPT_2 JLPT_3","w.,c]65Xdw","bột, bột"
"好み","このみ","liking, taste, choice","JLPT JLPT_2 JLPT_3","gist9XPg!/","thích, thích, lựa chọn"
"好む","このむ","to like, to prefer","JLPT JLPT_2 JLPT_3","O)%aoWh139","thích, thích hơn"
"こぼす","こぼす","to spill","JLPT JLPT_2 JLPT_3","eD]eIT[NNo","đổ"
"こぼれる","こぼれる","to overflow, to spill","JLPT JLPT_2 JLPT_3","D8@l08%7LL","tràn, tràn"
"塵","ごみ","garbage, litter","JLPT JLPT_2 JLPT_3","A^PPEPy8?0","rác, rác"
"小麦","こむぎ","wheat","JLPT JLPT_2 JLPT_3","QFa;ZcAclR","lúa mì"
"ごめんなさい","ごめんなさい","I beg your pardon, excuse me, I'm sorry","JLPT JLPT_3 JLPT_2 Genki_Ln.4 Genki","fxa7^/$d15","Tôi xin lỗi, xin lỗi, tôi xin lỗi"
"小屋","こや","hut, cabin, shed","JLPT JLPT_2 JLPT_3","L1:(fi`+1`","túp lều, cabin, nhà kho"
"これら","これら","these","JLPT JLPT_2 JLPT_3","bJ5Dn}}2bE","những cái này"
"殺す","ころす","to kill","JLPT JLPT_2 JLPT_3","FEbGULqZc5","giết"
"転ぶ","ころぶ","to fall down, to fall over","JLPT Genki_Ln.18 JLPT_3 JLPT_2 Genki","fb9L+KGLPL","ngã xuống, ngã xuống"
"今回","こんかい","now, this time, lately","JLPT JLPT_2 JLPT_3","v>V@:|&Nyu","bây giờ, lúc này, gần đây"
"今後","こんご","from now on, hereafter","JLPT JLPT_2 JLPT_3","i[%,=_sR{<","kể từ bây giờ, sau này"
"混雑","こんざつ","confusion, congestion","JLPT JLPT_2 JLPT_3","nJ8&5%w5iO","sự lộn xộn, ùn tắc"
"こんなに","こんなに","so, like this, in this way","JLPT JLPT_2 JLPT_3","yp0~/ynI.y","như vậy, như thế này, theo cách này"
"困難","こんなん","difficulty, distress","JLPT JLPT_2 JLPT_3","d&:m/eYAE}","khó khăn, đau khổ"
"今日","こんにち","today, this day","JLPT JLPT_2 JLPT_3","v>M{d#cP&m","hôm nay, ngày này"
"こんにちは","こんにちは","hello, good day (daytime greeting)","JLPT JLPT_2 JLPT_3","v[Wf5IN)l&","xin chào, một ngày tốt lành (lời chào ban ngày)"
"婚約","こんやく","engagement, betrothal","JLPT JLPT_2 JLPT_3","K{EyJ!,l%Q","sự đính hôn, đính hôn"
"混乱","こんらん","chaos, confusion, mayhem","JLPT JLPT_2 JLPT_3","FayR37Z,t-","hỗn loạn, hỗn loạn, hỗn loạn"
"差","さ","difference, variation","JLPT JLPT_2 JLPT_3","FOmfV#Q?35","sự khác biệt, sự khác biệt"
"サービス","サービス","service, support system; goods or services without charge","JLPT JLPT_2 JLPT_3","bg5_R(4_L^","hệ thống dịch vụ, hỗ trợ; hàng hóa hoặc dịch vụ miễn phí"
"際","さい","on the occasion of, circumstances","JLPT JLPT_2 JLPT_3","Nv+d+Us](G","nhân dịp, hoàn cảnh"
"最高","さいこう","highest, supreme, the most","JLPT JLPT_2 JLPT_3","Onra,t[Ph&","cao nhất, cao nhất, cao nhất"
"財産","ざいさん","property, fortune, assets","JLPT JLPT_2 JLPT_3","s;c/9B[#a4","tài sản, tài sản, tài sản"
"最終","さいしゅう","last, closing","JLPT JLPT_2 JLPT_3","flW!HkNC&a","cuối cùng, đóng cửa"
"最中","さいちゅう","in the middle of","JLPT JLPT_2 JLPT_3","Ek!(iCG2TX","ở giữa"
"最低","さいてい","least, lowest, worst","Genki_Ln.17 JLPT JLPT_3 JLPT_2 Genki","N/OsVi[gL-","ít nhất, thấp nhất, tệ nhất"
"才能","さいのう","talent, ability","JLPT JLPT_2 JLPT_3","DHNwuYd#?N","tài năng, khả năng"
"裁判","さいばん","trial, judgment","JLPT JLPT_2 JLPT_3","Cj0VNC)aXI","xét xử, phán xét"
"材料","ざいりょう","ingredients, material","JLPT JLPT_2 JLPT_3","k38qoD9zt6","thành phần, chất liệu"
"幸い","さいわい","fortunately; luckily","JLPT Intermediate_Japanese JLPT_3 JLPT_2 Intermediate_Japanese_Ln.8","d2lSIg);.","may mắn thay; may mắn thay"
"サイン","サイン","autograph; sign; sine","JLPT JLPT_2 JLPT_3","x?{c^]RVe$","chữ ký; dấu hiệu; sin"
"境","さかい","border, boundary, mental state","JLPT JLPT_2 JLPT_3","QShv^7rF%|","biên giới, ranh giới, trạng thái tinh thần"
"逆らう","さからう","to go against, to oppose, to disobey","JLPT JLPT_2 JLPT_3","o`A^ehWi@^","đi ngược lại, phản đối, không vâng lời"
"盛り","さかり","helping, serving","JLPT JLPT_2 JLPT_3","v$YrLV9qnx","giúp đỡ, phục vụ"
"作業","さぎょう","work, operation, manufacturing","JLPT JLPT_2 JLPT_3","b=vHpFfwSZ","công việc, vận hành, sản xuất"
"裂く","さく","to tear, to split","JLPT JLPT_2 JLPT_3","LDUwnq~#Q?","xé, chia"
"昨","さく","last (year), yesterday","JLPT JLPT_2 JLPT_3","GL+Y)4yXcS","năm ngoái (năm), hôm qua"
"作品","さくひん","work, opus, production","JLPT JLPT_2 JLPT_3","MGr8G06#z_","công việc, tác phẩm, sản xuất"
"作物","さくもつ","produce (e.g., agricultural), crops","JLPT JLPT_2 JLPT_3","p(LSOs6uw7","sản phẩm (ví dụ: nông nghiệp), cây trồng"
"桜","さくら","cherry blossom, cherry tree","JLPT JLPT_2 JLPT_3","Jm^a%*`E!g","hoa anh đào, cây anh đào"
"酒","さけ","alcohol, sake","JLPT JLPT_2 JLPT_3","t}%j30SHEF","rượu, rượu sake"
"叫ぶ","さけぶ","to shout, to cry","JLPT JLPT_2 JLPT_3","E5;W<1MI2|","hét lên, khóc"
"避ける","さける","to avoid (physical contact); to ward off, to avert","JLPT Intermediate_Japanese JLPT_3 JLPT_2 Intermediate_Japanese_Ln.15","QIaY:U+_Wa","để tránh (tiếp xúc vật lý); để tránh, ngăn chặn"
"支える","ささえる","support, hold, sustain","JLPT JLPT_2 JLPT_3","e#(-!es11Q","hỗ trợ, giữ, duy trì"
"刺さる","ささる","to stick, to be stuck","JLPT JLPT_2 JLPT_3","di2BW%43-n","dính, bị mắc kẹt"
"刺す","さす","to sting, to bite (e.g., bug), to prick, to stab","JLPT JLPT_3 JLPT_2 Genki Genki_Ln.21","e48t5Q~CL_","chích, cắn (ví dụ: bọ), chích, đâm"
"指す","さす","to point,","JLPT JLPT_2 JLPT_3","k`e;TAGgko","để chỉ,"
"挿す","さす","to insert, to put in, to graft","JLPT JLPT_2 JLPT_3","MY60EU`x,H","chèn vào, đưa vào, ghép"
"注す","さす","to pour (drink), to serve (drinks)","JLPT JLPT_2 JLPT_3","qH4&#`}]gG","rót (uống), phục vụ (đồ uống)"
"射す","さす","to shine, to strike","JLPT JLPT_2 JLPT_3","u.)8@5Yw87","tỏa sáng, tấn công"
"座席","ざせき","seat","JLPT Intermediate_Japanese JLPT_3 JLPT_2 Intermediate_Japanese_Ln.10","tDVi}8QLX,","ghế"
"誘う","さそう","to invite (someone to do something with you); to tempt, to lure","Genki_Ln.15 Intermediate_Japanese JLPT JLPT_3 JLPT_2 Intermediate_Japanese_Ln.7 Genki","t@[{w{yfI4","mời (ai đó làm gì cùng bạn); để cám dỗ, để thu hút"
"札","さつ","bill, note","JLPT JLPT_2 JLPT_3","wTy^V@~}^O","hóa đơn, ghi chú"
"作家","さっか","author, writer, novelist","JLPT JLPT_2 JLPT_3","BKI1ycChW6","tác giả, nhà văn, tiểu thuyết gia"
"作曲","さっきょく","composition (of music)","JLPT JLPT_2 JLPT_3","Io0i{.3D4v","sự sáng tác (của âm nhạc)"
"ざっと","ざっと","roughly, in round numbers","JLPT JLPT_2 JLPT_3","l]%gAJA,OM","đại khái, theo số tròn"
"さっぱり","さっぱり","feeling refreshed, neat","JLPT JLPT_2 JLPT_3","f,Wl.Ci0`l","cảm giác sảng khoái, gọn gàng"
"さて","さて","well; now (typically used when switching to a new, usually more important topic)","JLPT Intermediate_Japanese JLPT_3 JLPT_2 Intermediate_Japanese_Ln.12","LIh4>dp+/=","Tốt; bây giờ (thường được sử dụng khi chuyển sang một chủ đề mới, thường quan trọng hơn)"
"砂漠","さばく","desert","JLPT JLPT_2 JLPT_3","kKUmiT9F9W","sa mạc"
"差別","さべつ","discrimination, differentiation","JLPT JLPT_2 JLPT_3","dyD!/ON4A8","sự phân biệt, sự phân biệt"
"ママ","ママ","Mama","JLPT JLPT_2 JLPT_3","zyZFReMUU6","Mẹ"
"豆","まめ","beans, peas","JLPT JLPT_2 JLPT_3","GoM5kwLZ`E","đậu, đậu Hà Lan"
"守る","まもる","to protect; to abide (by the rules)","JLPT JLPT_2 JLPT_3","KIn|zt16*V","để bảo vệ; tuân thủ (theo quy tắc)"
"迷う","まよう","to be puzzled, to be perplexed, to lose one's way","JLPT JLPT_2 JLPT_3","L;:4YYq`)5","bối rối, bối rối, lạc đường"
"丸","まる","circle, full (month)","JLPT JLPT_2 JLPT_3","Q)LW*l-M`[","vòng tròn, đầy đủ (tháng)"
"円","まる","circle","JLPT JLPT_2 JLPT_3","c11Q@w}#J~","vòng tròn"
"まるで","まるで","just like","JLPT JLPT_2 JLPT_3","nQ6e%/X<.r","giống như"
"万一","まんいち","by some chance, if by any chance","JLPT JLPT_2 JLPT_3","H0H9j9*ddg","tình cờ nào đó, nếu có cơ hội nào đó"
"満足","まんぞく","satisfaction","JLPT JLPT_2 JLPT_3","Qfyuj9^wer","sự hài lòng"
"身","み","body, main part","JLPT JLPT_2 JLPT_3","FD}%mUxg1n","thân, bộ phận chính"
"実","み","fruit, seed, good result","JLPT JLPT_2 JLPT_3","j`zE[mIWkt","trái cây, hạt giống, kết quả tốt"
"見送り","みおくり","seeing one off","JLPT JLPT_2 JLPT_3","zL,W$(?WXy","tiễn một người"
"味方","みかた","ally, supporter","JLPT JLPT_2 JLPT_3","EF85/VL>m_","đồng minh, người ủng hộ"
"見事","みごと","splendid, magnificent","JLPT JLPT_2 JLPT_3","FG5RYvwId;","lộng lẫy, tráng lệ"
"ミス","ミス","miss (mistake, error, failure), Miss","JLPT_1 JLPT JLPT_2 JLPT_3","h#^4pNfLXB","miss (lỗi, lỗi, thất bại), Miss"
"満ちる","みちる","to be full, to mature","JLPT JLPT_2 JLPT_3","u[~LhQX)13","trở nên đầy đủ, trưởng thành"
"密","みつ","thick, close","JLPT JLPT_2 JLPT_3","Q7s<b_//qW","dày, đóng"
"認める","みとめる","to recognize, to notice; to approve","JLPT Intermediate_Japanese JLPT_3 JLPT_2 Intermediate_Japanese_Ln.13 Intermediate_Japanese_Ln.3","JetA%b8l~,","nhận ra, để ý; phê duyệt"
"見舞い","みまい","expression of sympathy, expression of concern","JLPT JLPT_2 JLPT_3","nw{(:&zpou","bày tỏ sự cảm thông, bày tỏ sự quan tâm"
"土産","みやげ","souvenir","JLPT JLPT_2 JLPT_3","z~]qvc)tb[","quà lưu niệm"
"都","みやこ","city; capital","JLPT Intermediate_Japanese JLPT_3 JLPT_2 Intermediate_Japanese_Ln.10","B3uIy2Ddpn","thành phố; thủ đô"
"妙","みょう","strange, unusual","JLPT JLPT_2 JLPT_3","LNAQ6Xt7x$","kỳ lạ, khác thường"
"明後日","みょうごにち","day after tomorrow","JLPT JLPT_2 JLPT_3","vq>.q}^O]P","ngày mốt"
"未来","みらい","future (life tense)","JLPT JLPT_2 JLPT_3","Ghk@nVs)kS","tương lai (thì cuộc sống)"
"魅力","みりょく","charm, fascination, appeal","JLPT JLPT_2 JLPT_3","w{[H?`kNh]","sự quyến rũ, sự quyến rũ, sự hấp dẫn"
"診る","みる","to examine (a patient)","JLPT Intermediate_Japanese JLPT_3 JLPT_2 Intermediate_Japanese_Ln.12","Ap.|xWc<xg","khám bệnh (bệnh nhân)"
"ミルク","ミルク","milk","JLPT JLPT_2 JLPT_3","rW2yU+[.3;","sữa"
"無","む","nothing, naught, zero","JLPT JLPT_2 JLPT_3","M/]]Gfu|C<","không có gì, không có gì, không"
"向かい","むかい","facing, opposite, across","JLPT JLPT_2 JLPT_3","v-M][z30<G","đối diện, đối diện, ngang qua"
"迎え","むかえ","meeting, person sent to pick up an arrival","JLPT JLPT_2 JLPT_3","M.JFq}D{XW","cuộc họp, người được phái đến để đón khách đến"
"向く","むく","to face","JLPT JLPT_2 JLPT_3","B?VOe(a,ck","đối mặt"
"剥く","むく","to peel, to skin","JLPT JLPT_2 JLPT_3","O9G!=VsU$R","lột da, lột da"
"向ける","むける","to turn towards, to point","JLPT JLPT_2 JLPT_3","O0#L}~28:p","hướng tới, chỉ vào"
"無視","むし","disregard, ignore","JLPT JLPT_2 JLPT_3","H?.,UKB|]n","coi thường, phớt lờ"
"蒸し暑い","むしあつい","humid, sultry","JLPT JLPT_2 JLPT_3","b:SYmm(y*W","ẩm ướt, oi bức"
"虫歯","むしば","cavity, tooth decay","JLPT JLPT_2 JLPT_3","p^*~90tI~;","sâu răng, sâu răng"
"寧ろ","むしろ","rather, better, instead","JLPT JLPT_2 JLPT_3","iKd&nF*kp>","đúng hơn, tốt hơn, thay vào đó"
"蒸す","むす","to steam, to poultice, to be sultry","JLPT JLPT_2 JLPT_3","A8e|Klqr_`","hấp, làm thuốc đắp, làm oi bức"
"結ぶ","むすぶ","to tie, to bind, to link","JLPT JLPT_2 JLPT_3","ymg7!.{d0`","buộc, buộc, liên kết"
"無駄","むだ","futility, uselessness","JLPT JLPT_2 JLPT_3","f?04M}_6S/","sự vô ích, sự vô ích"
"夢中","むちゅう","crush, crazy, be hooked on","JLPT JLPT_2 JLPT_3","c*kD_bu37.","nghiền nát, điên cuồng, bị cuốn hút"
"胸","むね","breast, chest","JLPT JLPT_2 JLPT_3","yLcSyJ#.nc","vú, ngực"
"無料","むりょう","free, no charge","JLPT JLPT_2 JLPT_3","JN6`<L^h|2","miễn phí, không tính phí"
"芽","め","sprout","JLPT JLPT_2 JLPT_3","j,J}0*}#hN","nảy mầm"
"明確","めいかく","clear, definite","JLPT JLPT_2 JLPT_3","DCM(3>-lRK","rõ ràng, dứt khoát"
"名刺","めいし","(name) card; business card","JLPT Intermediate_Japanese JLPT_3 JLPT_2 Intermediate_Japanese_Ln.1","K3cZp`gUUo","(tên) thẻ; danh thiếp"
"名詞","めいし","noun","JLPT JLPT_2 JLPT_3","iPorDGRE(|","danh từ"
"命じる","めいじる","to order, to command, to appoint","JLPT JLPT_2 JLPT_3","qg|.+Szu_I","ra lệnh, ra lệnh, bổ nhiệm"
"名人","めいじん","master, expert","JLPT JLPT_2 JLPT_3","Fni-n$8WrW","bậc thầy, chuyên gia"
"命令","めいれい","order, command, decree","JLPT JLPT_2 JLPT_3","KKSB-pS%yq","mệnh lệnh, mệnh lệnh, mệnh lệnh"
"迷惑","めいわく","trouble, bother, annoyance","JLPT JLPT_2 JLPT_3","i.t)w,3ng-","rắc rối, phiền toái, khó chịu"
"目上","めうえ","person of higher status; one's senior","JLPT Intermediate_Japanese JLPT_3 JLPT_2 Intermediate_Japanese_Ln.2","oNjcNV)ff[","người có địa vị cao hơn; cấp trên của một người"
"飯","めし","meals, food","JLPT JLPT_2 JLPT_3","IWA[~#BL^U","bữa ăn, đồ ăn"
"滅多に","めったに","rarely (with neg. verb), seldom","JLPT JLPT_2 JLPT_3","j)#=ex#L)O","hiếm khi (với động từ phủ định), hiếm khi"
"メモ","メモ","memorandum, note","JLPT JLPT_2 JLPT_3","skJ)D[(,@.","biên bản, ghi chú"
"面","めん","face, mug, surface, side or facet, corner, page","JLPT JLPT_2 JLPT_3","w,_Ik;ZYes","mặt, cốc, bề mặt, mặt bên hoặc mặt, góc, trang"
"綿","めん","cotton","JLPT JLPT_2 JLPT_3","zi)_)]=$49","bông"
"免許","めんきょ","license, permit, certificate","JLPT JLPT_3 JLPT_2 Genki_Ln.22 Genki","giqsadF8[_","giấy phép, giấy phép, giấy chứng nhận"
"面接","めんせつ","interview","JLPT Intermediate_Japanese JLPT_3 JLPT_2 Genki Genki_Ln.23 Intermediate_Japanese_Ln.3","G{,..f)t;T","phỏng vấn"
"面倒","めんどう","trouble, attention","JLPT JLPT_2 JLPT_3","jarwg?`xYM","rắc rối, chú ý"
"メンバー","メンバー","member","JLPT JLPT_2 JLPT_3","ioP<e}C#*T","thành viên"
"申し込む","もうしこむ","to apply for, to make an application","JLPT Intermediate_Japanese JLPT_3 JLPT_2 Intermediate_Japanese_Ln.3","p-@iqxnx(*","nộp đơn xin, làm đơn xin"
"申し訳","もうしわけ","apology, excuse","JLPT JLPT_2 JLPT_3","w0A,13h@XG","xin lỗi, xin lỗi"
"毛布","もうふ","blanket","JLPT JLPT_2 JLPT_3","G|6QSL6HzW","cái chăn"
"燃える","もえる","to burn","JLPT JLPT_2 JLPT_3","C2}(_d=*8]","đốt cháy"
"目的","もくてき","purpose, goal, aim","JLPT Intermediate_Japanese JLPT_3 JLPT_2 Intermediate_Japanese_Ln.3","FrxXy0,/EI","mục đích, mục tiêu, mục tiêu"
"目標","もくひょう","mark, objective, target","JLPT JLPT_2 JLPT_3","eD#(2kEfi#","đánh dấu, mục tiêu, mục tiêu"
"文字","もじ","letter (of alphabet), character","JLPT JLPT_2 JLPT_3","v{bw_z2KT.","chữ cái (trong bảng chữ cái), ký tự"
"文字","もんじ","letter (of alphabet), character","JLPT JLPT_2 JLPT_3","i}R1C0Kg[i","chữ cái (trong bảng chữ cái), ký tự"
"もしかすると","もしかすると","perhaps, maybe, by some chance","JLPT JLPT_2 JLPT_3","E_gTNRA!W1","có lẽ, có lẽ, tình cờ nào đó"
"もしも","もしも","if","JLPT JLPT_2 JLPT_3","Q41Ox`49(P","nếu như"
"持ち上げる","もちあげる","to raise, to lift up, to flatter","JLPT JLPT_2 JLPT_3","Ck3.ZXZ[6p","nâng lên, nâng lên, tâng bốc"
"用いる","もちいる","to use, to make use of","JLPT JLPT_2 JLPT_3","so5H6d<zN+","sử dụng, tận dụng"
"もったいない","もったいない","wasteful; more than one deserves, unworthy of","JLPT JLPT_2 JLPT_3","yewBxbz7]I","lãng phí; nhiều hơn một người xứng đáng, không xứng đáng"
"尤も","もっとも","quite right, plausible, natural","JLPT JLPT_2 JLPT_3","A>F:Ft1w22","khá đúng, hợp lý, tự nhiên"
"元","もと","origin, original; former","JLPT JLPT_2 JLPT_3","O)La7,`]AY","nguồn gốc, nguyên gốc; trước"
"基","もと","basis","JLPT JLPT_2 JLPT_3","Icp_M75Xpg","cơ sở"
"素","もと","prime","JLPT JLPT_2 JLPT_3","yGr3{oX4%H","xuất sắc"
"戻す","もどす","to restore, to put back, to return","JLPT JLPT_2 JLPT_3","PmY(.gc-w+","khôi phục, đặt lại, trả lại"
"基づく","もとづく","to be grounded on, to be based on","JLPT JLPT_2 JLPT_3","I&bTc?WHhL","căn cứ vào, dựa vào"
"求める","もとめる","to request, to ask for; to seek, to search for","JLPT Intermediate_Japanese JLPT_3 JLPT_2 Intermediate_Japanese_Ln.4","lJ&@p010:m","yêu cầu, yêu cầu; tìm kiếm, tìm kiếm"
"者","もの","person (same as 人 (ひと))","JLPT Intermediate_Japanese JLPT_3 JLPT_2 Intermediate_Japanese_Ln.3","vAI([v0H/E","người (giống như 人 (ひと))"
"物音","ものおと","sounds","JLPT JLPT_2 JLPT_3","hL<`ZEm#E^","âm thanh"
"物語","ものがたり","tale, story, legend","JLPT JLPT_2 JLPT_3","b2F39/cX@{","câu chuyện, câu chuyện, truyền thuyết"
"物事","ものごと","things, everything","JLPT JLPT_2 JLPT_3","JYu;9)KWYP","mọi thứ, mọi thứ"
"燃やす","もやす","to burn","JLPT JLPT_2 JLPT_3","h5FjFnJT{r","đốt cháy"
"模様","もよう","pattern, figure, design","JLPT JLPT_2 JLPT_3","DCW6|C<9T)","mẫu, hình, thiết kế"
"文句","もんく","a complaint","JLPT Intermediate_Japanese Genki JLPT_3 JLPT_2 Intermediate_Japanese_Ln.14 Genki_Ln.21 Intermediate_Japanese_Ln.11","q,87=b37fY","một lời phàn nàn"
"やがて","やがて","before long, soon, at length","JLPT Intermediate_Japanese JLPT_3 JLPT_2 Intermediate_Japanese_Ln.8","nlnms.mL_|","chẳng bao lâu, chẳng bao lâu, lâu dài"
"役","やく","role, position","JLPT JLPT_2 JLPT_3","sc=i9?h^tQ","vai trò, vị trí"
"約","やく","approximately, about, some","JLPT Intermediate_Japanese JLPT_3 JLPT_2 Intermediate_Japanese_Ln.11","L31l;C5Xp=","xấp xỉ, khoảng, một số"
"訳","やく","translation","JLPT JLPT_2 JLPT_3","CmgPQjblgT","dịch thuật"
"訳す","やくす","to translate","JLPT Intermediate_Japanese JLPT_3 JLPT_2 Intermediate_Japanese_Ln.2","Cj2Ni~H!BW","dịch"
"役割","やくわり","assigning (allotment of) parts, role, duties","JLPT JLPT_2 JLPT_3","jj*z,nk6$Z","phân công (phân công) bộ phận, vai trò, nhiệm vụ"
"家賃","やちん","rent","JLPT Genki_Ln.18 JLPT_3 JLPT_2 Genki","Og7<v^:R8@","thuê"
"厄介","やっかい","trouble, burden, care","JLPT JLPT_2 JLPT_3","O_#+8qFx*C","rắc rối, gánh nặng, sự quan tâm"
"宿","やど","inn, lodging","JLPT JLPT_2 JLPT_3","F8A%9EzpfO","nhà trọ, chỗ ở"
"雇う","やとう","to employ, to hire","JLPT Intermediate_Japanese JLPT_3 JLPT_2 Intermediate_Japanese_Ln.8","fsV)jU5lVf","tuyển dụng, thuê mướn"
"屋根","やね","roof","JLPT JLPT_2 JLPT_3","K@]5qy=.%v","mái nhà"
"破る","やぶる","to tear; to violate; to defeat","JLPT JLPT_2 JLPT_3","Hc|1rO==::","xé ; vi phạm; đánh bại"
"破れる","やぶれる","to get torn, to wear out","JLPT JLPT_2 JLPT_3","Q>N&s5^Kb%","bị rách, bị mòn"
"辞める","やめる","to retire","JLPT JLPT_2 JLPT_3","J|2c^zFs0y","nghỉ hưu"
"やや","やや","a little, partially, somewhat","JLPT JLPT_2 JLPT_3","OikgR+nKY0","một chút, một phần, một chút"
